Наименование,Описание,Категория,Цена,Фото
Лаваш с домашним сыром,"Рулет из кавказского лаваша и свежей брынзы, обжаренной на гриле, с салатом Коул Слоу и домашней сметаной.",Закуски и Салаты,290 с,https://nambafood.kg/dish_image/141323.png
Грибочки под водочку,"Маринованные вешенки и опята с лучком, заправленные подсолнечным маслом.",Закуски и Салаты,290 с,https://nambafood.kg/dish_image/47014.png
Закуска по-русски,"Сельдь слабосоленная, отварной картофель, огурчики домашнего засола. Подается с бородинским хлебом и сливочным маслом.",Закуски и Салаты,320 с,https://nambafood.kg/dish_image/76549.png
Кавказский букет,"Ассорти из свежих огурцов и помидоров, сладкого болгарского перца, мягкой брынзы, маслин и зелени.",Закуски и Салаты,320 с,https://nambafood.kg/dish_image/141329.png
Домашние соленья,"Огурчики домашнего засола, маринованные помидорчики черри, квашенная капуста, патиссоны и маринованные маслины.",Закуски и Салаты,320 с,https://nambafood.kg/dish_image/47018.png
Закуска по-украински,"Три вида салата, маринованные огурчики, помидоры черри, бородинский хлеб, Подается с горчицей, чесноком и луком.",Закуски и Салаты,420 с,https://nambafood.kg/dish_image/141315.png
Сырная тарелка,"Оригинальная закуска из пяти видов сыров. Подается с медом, грецкими орехами, оливками, яблоком.",Закуски и Салаты,460 с,https://nambafood.kg/dish_image/141313.png
Beef Бургер,"Котлета из телятины, сыр Чеддер, свежие помидоры, маринованные огурчики, салат Айсберг, фирменный соус, картофель фри",Закуски и Салаты,399 с,https://nambafood.kg/dish_image/141302.png
Pinta Бургер,"Котлета из телятины и баранины, сыр чеддер, свежие помидоры, маринованные огурчики, салат Айсберг, фирменный соус, картофель фри",Закуски и Салаты,399 с,https://nambafood.kg/dish_image/141304.png
Chicken Бургер,"Котлета из курицы, сыр Чеддер, свежие помидоры, маринованные огурчики, салат Айсберг, фирменный соус, картофель фри",Закуски и Салаты,379 с,https://nambafood.kg/dish_image/141316.png
Mexican Бургер,"Котлета из телятины, сыр Чеддер, свежие помидоры, маринованные огурчики, салат Айсберг, перец халапеньо, фирменный острый соус, картофель фри",Закуски и Салаты,399 с,https://nambafood.kg/dish_image/141308.png
Оливье с мясом,Классический салат с мясом.,Салаты,260 с,https://nambafood.kg/dish_image/116103.png
Летний салат,"Салат из свежих помидоров и огурцов, сладкого болгарского перца и зелени заправленный на выбор: дрессинг \ лимон \ масло \ майонез \ сметана",Салаты,280 с,https://nambafood.kg/dish_image/141331.png
Гриль салат,"Нежное куриное филе, обжаренное на гриле с помидорами, кабачками и сладким перцем, под соусом тар-тар.",Салаты,340 с,https://nambafood.kg/dish_image/141333.png
Греческий салат,"Салат из свежих овощей с маслинами, сыром фетакса и греческим соусом.",Салаты,340 с,https://nambafood.kg/dish_image/47026.png
Остренький салат,"Пикантный салат из обжаренной телятины, свежих огурцов, сладкого перца, заправленный соевым соусом.",Салаты,340 с,https://nambafood.kg/dish_image/47025.png
Салат из баклажанов с мясом,"Теплый салат с жареной говядиной, баклажанами, помидорами, луком, сладким перцем, приправленный соевым соусом с кунжутом.",Салаты,380 с,https://nambafood.kg/dish_image/141337.png
Цезарь с курицей,"Нежная куриная грудка, обжаренная на гриле, свежие листья салата, крутоны и сыр пармезан, заправленные фирменным соусом «Цезарь».",Салаты,460 с,https://nambafood.kg/dish_image/116071.png
Вареники,Домашние вареники с картофельным пюре.,Супы,220 с,https://nambafood.kg/dish_image/46985.png
Суп-лапша по-домашнему,Ароматный куриный бульон с домашней лапшой и курицей.,Супы,220 с,https://nambafood.kg/dish_image/47056.png
Пельмени с говядиной,Домашние пельмени с говядиной.,Супы,240 с,https://nambafood.kg/dish_image/46986.png
Суп с фрикадельками,Домашний суп с нежными фрикадельками.,Супы,240 с,https://nambafood.kg/dish_image/46988.png
Грибной крем суп,Суп-пюре из шампиньонов.,Супы,280 с,https://nambafood.kg/dish_image/46989.png
Солянка,Сборная мясная солянка.,Супы,340 с,https://nambafood.kg/dish_image/46990.png
Уха царская,Уха из форели и судака с овощами.,Супы,340 с,https://nambafood.kg/dish_image/46991.png
Том-ям,"Кисло-острый тайский суп с лососем, креветками, кальмарами и шампиньонами. Подается с рисом.",Супы,399 с,https://nambafood.kg/dish_image/68270.png
Болоньезе,Спагетти с мясным соусом и овощами.,Паста,360 с,https://nambafood.kg/dish_image/141326.png
Карбонара,"Паста тальятелле с обжаренным беконом, яйцом и сливками с сыром пармезан.",Паста,360 с,https://nambafood.kg/dish_image/141332.png
Фарфалле с грибами,"Паста фарфалле с обжаренными шампиньонами, с зеленью, сыром пармезан и сырным соусом.",Паста,380 с,https://nambafood.kg/dish_image/46994.png
Феттучини с семгой,Паста феттучини с семгой и пармезаном.,Паста,440 с,https://nambafood.kg/dish_image/68272.png
Бефстроганов с рисом,Обжаренное мясо молодой телятины с луком домашней сметаной.,Блюда из говядины,459 с,https://nambafood.kg/dish_image/116073.png
Бефстроганов с пюре,Обжаренное мясо молодой телятины с луком домашней сметаной.,Блюда из говядины,449 с,https://nambafood.kg/dish_image/116072.png
Бифштекс с яйцом и пюре,"Нежная и румяная котлета из телятины, с яичной глазуньей.",Блюда из говядины,449 с,https://nambafood.kg/dish_image/116074.png
Бифштекс с яйцом и рисом,"Нежная и румяная котлета из телятины, с яичной глазуньей.",Блюда из говядины,459 с,https://nambafood.kg/dish_image/116075.png
Филе миньон,Стейк из бон филе. Подается со свежим салатом из помидоров и зелени.,Блюда из говядины,490 с,https://nambafood.kg/dish_image/141314.png
Рибай стейк,Говяжий стейк из толстого края без кости - безусловное удовольствие для любителей стейков. Подается со свежим салатом из помидоров и зелени.,Стейки из говядины,849 с,https://nambafood.kg/dish_image/47060.png
Нью-Йорк стейк,Знаменитый стейк из поясничной части с насыщенным мясным вкусом.,Стейки из говядины,849 с,https://nambafood.kg/dish_image/47061.png
Ти-бон стейк,Роскошный стейк с Т-образной косточкой сочетает насыщенность стриплойна и нежность бон филе. Подается с овощами гриль.,Стейки из говядины,899 с,https://nambafood.kg/dish_image/46946.png
Ребрышки деликатесные,Запеченные ребрышки ягненка в соево-медовом маринаде. Подаются с овощами гриль.,Блюда из баранины,520 с,https://nambafood.kg/dish_image/141322.png
Баранья рулька Pinta,Запеченная рулька барашка подается с картофельным пюре.,Блюда из баранины,"449 с


                    540 с",https://nambafood.kg/dish_image/47079.png
Стейк из свинины на гриле,Обжаренный на гриле нежный свиной стейк под гранатовым соусом.,Блюда из свинины,540 с,https://nambafood.kg/dish_image/141325.png
Ребрышки «Pinta»,Запеченные нежнейшие свиные ребрышки. Подаются со свежим салатом из помидоров и зелени.,Блюда из свинины,540 с,https://nambafood.kg/dish_image/116077.png
Баварская свиная рулька,"Блюдо на компанию. Подается с картофельным пюре, квашеной капустой, горчицей и хреном.",Блюда из свинины,949 с,https://nambafood.kg/dish_image/47033.png
Курица под сырным соусом,Нежное куриное филе в сырном соусе с брокколи и помидорами черри.,Блюда из птицы,340 с,https://nambafood.kg/dish_image/47082.png
Фрикасе из курицы,Нежное куриное филе с грибами и луком и домашней сметаной.,Блюда из птицы,320 с,https://nambafood.kg/dish_image/46981.png
Крылышки Баффало,Хрустящие куриные крылышки с острым соусом. Подаются с картофелем по-деревенски.,Блюда из птицы,390 с,https://nambafood.kg/dish_image/141319.png
Судак на гриле,Филе судака обжаренное на гриле. Подается с жареными шампиньонами в сливочном соусе.,Рыба,420 с,https://nambafood.kg/dish_image/46976.png
Fish & Chips,"Хрустящее филе рыбы в кляре, подается с картофелем по-деревенски.",Рыба,480 с,https://nambafood.kg/dish_image/141311.png
Стейк из форели Pinta,"Филе форели, обжаренное до румяной корочки, с соусом нуазет.",Рыба,490 с,https://nambafood.kg/dish_image/46979.png
Форель супрем,"форель, приготовленная с овощами на пару. 300 гр.",Рыба,490 с,https://nambafood.kg/dish_image/46978.png
Курица на жаровне,"Нежное куриное филе, обжаренное со свежими овощами и специями.",Блюда на жаровне,360 с,https://nambafood.kg/dish_image/85137.png
Говядина на жаровне,"Нежная телятина, обжаренная со свежими овощами и специями.",Блюда на жаровне,390 с,https://nambafood.kg/dish_image/47073.png
Форель на жаровне,"Обжаренное филе форели, со свежими овощами и специями.",Блюда на жаровне,390 с,https://nambafood.kg/dish_image/141320.png
Шашлык из печени,,Шашлыки и кебабы,260 с,https://nambafood.kg/dish_image/46958.png
Шашлык из печени в рубашке,,Шашлыки и кебабы,310 с,https://nambafood.kg/dish_image/47084.png
Люля кебаб,,Шашлыки и кебабы,"229 с


                    290 с",https://nambafood.kg/dish_image/46962.png
Оромо-кебаб,,Шашлыки и кебабы,310 с,https://nambafood.kg/dish_image/68280.png
Шашлык из баранины,,Шашлыки и кебабы,340 с,https://nambafood.kg/dish_image/46965.png
Бараньи ребрышки «Семечки»,,Шашлыки и кебабы,360 с,https://nambafood.kg/dish_image/47085.png
Антрекот из баранины,,Шашлыки и кебабы,450 с,https://nambafood.kg/dish_image/141336.png
Шашлык из курицы,,Шашлыки и кебабы,310 с,https://nambafood.kg/dish_image/46960.png
Шашлык куриные крылышки,,Шашлыки и кебабы,310 с,https://nambafood.kg/dish_image/46961.png
Шашлык из говядины,,Шашлыки и кебабы,340 с,https://nambafood.kg/dish_image/46964.png
Шашлык из свинины,,Шашлыки и кебабы,340 с,https://nambafood.kg/dish_image/46963.png
Креветки на гриле,,Шашлыки и кебабы,480 с,https://nambafood.kg/dish_image/141330.png
Форель на углях 0.5,,Шашлыки и кебабы,490 с,https://nambafood.kg/dish_image/77104.png
Картофель на мангале,,Шашлыки и кебабы,150 с,https://nambafood.kg/dish_image/46972.png
Овощи на мангале,,Шашлыки и кебабы,240 с,https://nambafood.kg/dish_image/46971.png
Шампиньоны на шпажках,,Шашлыки и кебабы,310 с,https://nambafood.kg/dish_image/141334.png
Соус к шашлыку,,Шашлыки и кебабы,79 с,https://nambafood.kg/dish_image/46973.png
Лепешка на углях,,Шашлыки и кебабы,79 с,https://nambafood.kg/dish_image/46974.png
Шашлычный сет «Cолидный»,"Шашлык из баранины, говядины, печень в рубашке, оромо кебаб, антрекот из баранины, бараньи ребрышки семечки, овощи на мангале, соус, лепешка на углях.",Сеты,3150 с,https://nambafood.kg/dish_image/85138.png
Сет шашлычный малый,"Шашлык  из баранины, говядина, печень в рубашке, бараньи ребрышки семечки, овощи на мангале, соус, лепешки на углях.",Сеты,1990 с,https://nambafood.kg/dish_image/85140.png
Барбекю сет с картофелем,"Шашлык из баранины, говядины, курицы, оромо кебаб, баранина оромо, картофель на мангале, овощи на мангале, соус, лепешка на углях.",Сеты,1830 с,https://nambafood.kg/dish_image/116079.png
Барбекю сет с кукурузой,"Шашлык из баранины, говядины, курицы, оромо кебаб, баранина оромо, кукуруза на мангале, овощи на мангале, соус, лепешка на углях.",Сеты,1830 с,https://nambafood.kg/dish_image/116080.png
Расколбас по-баварски,"Колбаски албанские, колбаски бременские, тушенная квашенная капуста, картофель по домашнему,  горчица, соус из хрена.",Сеты,1430 с,https://nambafood.kg/dish_image/116081.png
Хрустящая тарелка,"Жареный чечел, хрустящие сырные палочки, луковые кольца, чесночные гарлики, картофель по-деревенски.",Сеты,1460 с,https://nambafood.kg/dish_image/116082.png
Луковые кольца,"Луковые кольца, обжаренные в панировке, хрустящие снаружи, нежные внутри.",Блюда к пиву,170 с,https://nambafood.kg/dish_image/141335.png
Чесночные гарлики Pinta,"Хрустящие гренки из ржаного хлеба с чесноком, подаются со сливочно-чесночным соусом.",Блюда к пиву,220 с,https://nambafood.kg/dish_image/68281.png
Хрустящие сырные палочки,"Ломтики белого сыра в панировке, обжаренные до хрустящей корочки. Подаются с чесночно-ореховым соусом.",Блюда к пиву,320 с,https://nambafood.kg/dish_image/116083.png
Хрустящие кольца кальмара,"Кольца кальмара, обжаренные в кляре и панировке, хрустящие снаружи и нежные внутри.",Блюда к пиву,330 с,https://nambafood.kg/dish_image/76556.png
Пивные креветки,"Креветки, отваренные в пряном бульоне с лимоном и зеленью.",Блюда к пиву,480 с,https://nambafood.kg/dish_image/141321.png
Жареные креветки,"Королевские креветки, обжаренные с чесноком и специями.",Блюда к пиву,480 с,https://nambafood.kg/dish_image/141312.png
Мидии запеченные,"Королевские мидии, запеченные в сливочно-чесночном соусе.",Блюда к пиву,620 с,https://nambafood.kg/dish_image/141318.png
Албанские колбаски,200 г. Из баранины.,Блюда к пиву,380 с,https://nambafood.kg/dish_image/116084.png
Бременские колбаски,200 г. Из курицы.,Блюда к пиву,380 с,https://nambafood.kg/dish_image/116085.png
Колбаски кабаносси,"200 г. Из говядины, свинины.",Блюда к пиву,380 с,https://nambafood.kg/dish_image/116086.png
Пицца Маргарита,"Сыр моцарелла, маслины, помидоры.",Пицца,320 с,https://nambafood.kg/dish_image/141324.png
Пицца Куриная,"Куриное филе, чеснок, сыр моцарелла.",Пицца,390 с,https://nambafood.kg/dish_image/116088.png
Пицца Пепперони,"Салями, шампиньоны, сыр моцарелла.",Пицца,420 с,https://nambafood.kg/dish_image/116089.png
Пицца Чили,"Говяжий фарш, огурцы, сыр моцарелла, острый соус.",Пицца,420 с,https://nambafood.kg/dish_image/116090.png
Картофельное пюре,,Гарниры,109 с,https://nambafood.kg/dish_image/116091.png
Рис,,Гарниры,119 с,https://nambafood.kg/dish_image/116093.png
Картофель по-домашнему,,Гарниры,160 с,https://nambafood.kg/dish_image/47036.png
Картофель фри,,Гарниры,160 с,https://nambafood.kg/dish_image/141327.png
Картофель по-деревенски,,Гарниры,180 с,https://nambafood.kg/dish_image/116092.png
Крокеты из картофеля,,Гарниры,180 с,https://nambafood.kg/dish_image/47037.png
Тушеная квашеная капуста,,Гарниры,160 с,https://nambafood.kg/dish_image/116095.png
Брокколи на гарнир,,Гарниры,180 с,https://nambafood.kg/dish_image/116096.png
Овощи гриль,,Гарниры,240 с,https://nambafood.kg/dish_image/76577.png
Фруктовый штрудель с мороженым,400 г,Десерты,380 с,https://nambafood.kg/dish_image/46954.png
Шоколадный круассан,,Десерты,340 с,https://nambafood.kg/dish_image/46955.png
