Наименование,Описание,Категория,Цена,Фото
Шашлычки куриные,,Детское меню,219 с,https://nambafood.kg/dish_image/145470.png
Суп лапша,,Детское меню,199 с,https://nambafood.kg/dish_image/145471.png
Шашлычки из форели,,Детское меню,239 с,https://nambafood.kg/dish_image/145472.png
Куриные котлетки с пюре,,Детское меню,209 с,https://nambafood.kg/dish_image/145475.png
Фетучини из форели,,Детское меню,279 с,https://nambafood.kg/dish_image/145473.png
Сырные палочки,,Детское меню,259 с,https://nambafood.kg/dish_image/145474.png
Куриные наггетсы с фри,,Детское меню,299 с,https://nambafood.kg/dish_image/145476.png
Мини бургер с курицей,,Детское меню,269 с,https://nambafood.kg/dish_image/145477.png
Мини с говядиной,,Детское меню,279 с,https://nambafood.kg/dish_image/145478.png
Поке боул с креветками,"Креветки, огурцы, помидоры черри, эдамаме и рис",Боулы,499 с,https://nambafood.kg/dish_image/145479.png
Боул с рисовый крокетами и форель,"Рисовые крокеты, форель, авокадо, огурцы, помидоры черри соус чили- манго",Боулы,629 с,https://nambafood.kg/dish_image/145480.png
Веган боул,"Помидоры черри, красная капуста, эдамаме, авокадо, соево-имбирный соус",Боулы,399 с,https://nambafood.kg/dish_image/145481.png
Поке боул с лососем,"Лосось, рис, эдамаме, авокадо, красная капуста, помидоры черри и мусс васаби",Боулы,489 с,https://nambafood.kg/dish_image/145482.png
Цезарь с курицей,"Листья салата, чесночные крутоны с жареной куриной грудкой, помидорами черри, с сыром пармезан, заправленный соусом цезарь.",Салаты,449 с,https://nambafood.kg/dish_image/145810.png
Цезарь с креветками,"Листья салата, чесночные крутоны, с жареными креветками, помидорами черри, с сыром пармезан, заправленный соусом цезарь.",Салаты,569 с,https://nambafood.kg/dish_image/145809.png
Салат с креветками,"Айсберг, руколла, креветки, помидоры черри заправленные бальзамическим соусом с сыром Пармезан и кедровыми орехами.",Салаты,729 с,https://nambafood.kg/dish_image/64850.png
Мисато салат,"Кальмары, креветки, авокадо, апельсин, помидоры черри, заправляется японским соусом на основе тобико.",Салаты,579 с,https://nambafood.kg/dish_image/64842.png
Салат с авокадо и креветками,,Салаты,659 с,https://nambafood.kg/dish_image/104683.png
Греческий салат,"Листья салата со свежими овощами, брынзой, заправленные фирменным соусом.",Салаты,489 с,https://nambafood.kg/dish_image/64911.png
Салат с креветками на шпажках,"В кисло-сладком соусе, с проросшими бобами, морковью, редисом и помидорами черри.",Салаты,599 с,https://nambafood.kg/dish_image/64917.png
Легкий салат с форелью,,Салаты,429 с,https://nambafood.kg/dish_image/145483.png
Салат из баклажанов в китайском стиле,"Хрустящие кусочки баклажана с помидорами черри, заправленные фирменным соусом.",Салаты,449 с,https://nambafood.kg/dish_image/64912.png
Салат «Кайсен»,"C атлантическим кальмаром, малосольным лососем и жареными креветками, с миксом из листьев салата, заправленный соусом Кайсен (на основе соевого соуса и рисового уксуса)",Салаты,629 с,https://nambafood.kg/dish_image/64913.png
Салат с огурцом и арахисом,Заправленный кисло-сладким соусом и кунжутным маслом.,Салаты,359 с,https://nambafood.kg/dish_image/64843.png
Тофу микс-салат,"Салат с тофу, микс-салатом и киноа.",Салаты,419 с,https://nambafood.kg/dish_image/64846.png
Шашлычки из тофу с овощами,,Салаты,429 с,https://nambafood.kg/dish_image/64847.png
Салат с говядиной в пикантном соусе,"Со стручковой фасолью, помидорами черри, редисом и куриным яйцом.",Салаты,529 с,https://nambafood.kg/dish_image/64915.png
Чука салат,,Салаты,399 с,https://nambafood.kg/dish_image/145813.png
Татаки с тунцом,"Опаленный тунец, клубника, яблоко, пюре манго, соево-имбирный соус",Холодные  закуски,559 с,https://nambafood.kg/dish_image/145484.png
Татаки с лососем,"Опаленный лосось, клубника, яблоко, пюре манго, соева-имбирный соус",Холодные  закуски,699 с,https://nambafood.kg/dish_image/145485.png
Карпаччо из лосося,,Холодные  закуски,929 с,https://nambafood.kg/dish_image/145486.png
Тар-тар из лосося,С кусочками авокадо в соусе понзу.,Холодные  закуски,849 с,https://nambafood.kg/dish_image/64854.png
Тар-тар из тунца,С кусочками авокадо в соусе понзу.,Холодные  закуски,899 с,https://nambafood.kg/dish_image/64855.png
Сырное ассорти,"Ореховый сыр, грано подано, дор блю, моцарелла в рассоле, мед, украшается виноградом, грецкими орехами и яблоками.",Холодные  закуски,759 с,https://nambafood.kg/dish_image/64853.png
Жареная фасоль с кунжутом,,Закуски,499 с,https://nambafood.kg/dish_image/145856.png
Fish авокадо и яблоки,"Форель, авокадо, блоко су-вид соус манго",Закуски,599 с,https://nambafood.kg/dish_image/145487.png
Агэ-тофу,"Сыр тофу, обжаренный в соево-кунжутном соусе с добавлением кинзы и специй.",Закуски,299 с,https://nambafood.kg/dish_image/64848.png
Тофу в имбирном соусе,С чесноком и перцем hot чили.,Закуски,389 с,https://nambafood.kg/dish_image/64856.png
Шашлычки из кальмаров,В соусе терияки.,Закуски,499 с,https://nambafood.kg/dish_image/64858.png
Спринг роллы с курицей,,Закуски,389 с,https://nambafood.kg/dish_image/145814.png
Спринг роллы с креветками,,Закуски,469 с,https://nambafood.kg/dish_image/145815.png
Спринг роллы с говядиной,,Закуски,489 с,https://nambafood.kg/dish_image/145816.png
Шашлычки эби,В соусе терияки.,Закуски,699 с,https://nambafood.kg/dish_image/64860.png
Креветки «Динамит»,"Жареные хрустящие креветки в кляре, в фирменном остром соусе Динамит",Закуски,779 с,https://nambafood.kg/dish_image/64896.png
Шашлычки из лосося,В соусе терияки.,Закуски,799 с,https://nambafood.kg/dish_image/64859.png
Креветки «Васаби»,"Жареные хрустящие креветки в кляре, в фирменном соусе с добавлением васаби.",Закуски,799 с,https://nambafood.kg/dish_image/145811.png
Креветки «Имбирные»,"Хрустящие креветки в кляре в белом сладком соусе и кислом соусе, с добавлением сока лайма.",Закуски,819 с,https://nambafood.kg/dish_image/145812.png
Рамен Кимчи,,Супы,479 с,https://nambafood.kg/dish_image/64905.png
Рамен с курицей,,Супы,529 с,https://nambafood.kg/dish_image/64908.png
Рамен с говядиной,,Супы,579 с,https://nambafood.kg/dish_image/64906.png
Рамен с креветками и лососем,,Супы,779 с,https://nambafood.kg/dish_image/64907.png
Мисо классический,,Супы,259 с,https://nambafood.kg/dish_image/64899.png
Мисо суп с креветками,,Супы,339 с,https://nambafood.kg/dish_image/64900.png
Мисо суп с лососем,,Супы,439 с,https://nambafood.kg/dish_image/64901.png
Том Ям Кай,"Тайский пикантный суп на основе галангала, лемонграсса, листа кафирлайма, кокосового молока и куриного бульона с вешенками и куриным филе.",Супы,469 с,https://nambafood.kg/dish_image/64867.png
Том Ям Кунг,"Тайский пикантный суп на основе галангала, лемонграсса, листа кафирлайма и куриного бульона, с грибами шиитаке и тигровыми креветками.",Супы,579 с,https://nambafood.kg/dish_image/64929.png
Суп чечевичный,,Супы,229 с,https://nambafood.kg/dish_image/64866.png
Грибной крем-суп,Крем-суп из трех видов грибов с кокосовым молоком,Супы,199 с,https://nambafood.kg/dish_image/145488.png
Острый китайский суп,"Суп с говядиной и куриным филе, рисовой лапшой, проросшими бобами, болгарским перцем, картофелем, морковью, перцем чили и древесными грибами.",Супы,369 с,https://nambafood.kg/dish_image/64902.png
Сакана набе,Острый суп на основе рыбного бульона с морепродуктами и кинзой.,Супы,529 с,https://nambafood.kg/dish_image/64909.png
Суп Дзосуй с лососем,"Оригинальный суп с нежным лососем, взбитым яйцом и водорослями вакамэ.",Супы,399 с,https://nambafood.kg/dish_image/104684.png
Спагетти Карбонара с курицей,Спагетти с куриной грудкой под сливочным соусом.,Лапша / Паста,419 с,https://nambafood.kg/dish_image/64851.png
Альфредо,Лапша феттучини с куриной грудкой и шампиньонами под сливочным соусом.,Лапша / Паста,439 с,https://nambafood.kg/dish_image/64849.png
Болоньезе,Спагетти с тушеным говяжьим фаршем под томатным соусом.,Лапша / Паста,429 с,https://nambafood.kg/dish_image/64892.png
Феттучини с семгой,Лапша феттучини с семгой под томатно-сливочным соусом.,Лапша / Паста,519 с,https://nambafood.kg/dish_image/64932.png
Фунчеза с курицей,,Лапша WOK,329 с,https://nambafood.kg/dish_image/116867.png
Фунчеза с говядиной,,Лапша WOK,419 с,https://nambafood.kg/dish_image/116868.png
Удон с курицей,,Лапша WOK,419 с,https://nambafood.kg/dish_image/145819.png
Удон с говядиной,,Лапша WOK,559 с,https://nambafood.kg/dish_image/145817.png
Удон с креветками,,Лапша WOK,559 с,https://nambafood.kg/dish_image/145818.png
Пад Тай c креветками,"Рисовая лапша с креветками, овощами и соусом Пад тай.",Лапша WOK,559 с,https://nambafood.kg/dish_image/64903.png
Пад Тай c курицей,Рисовая лапша с овощами и соусом Пад тай.,Лапша WOK,439 с,https://nambafood.kg/dish_image/76956.png
Соба с морепродуктами,,Лапша WOK,759 с,https://nambafood.kg/dish_image/70709.png
Соба с курицей,,Лапша WOK,469 с,https://nambafood.kg/dish_image/64863.png
Соба с говядиной,,Лапша WOK,599 с,https://nambafood.kg/dish_image/76957.png
Стейк из форели с овощами Wok,Запеченная форель с соево-рисовым соусом,Горячие блюда,439 с,https://nambafood.kg/dish_image/145489.png
Унатама дзю,Угорь на рисе.,Горячие блюда,679 с,https://nambafood.kg/dish_image/104686.png
Палтус том ям мисо,"Запеченное филе палтуса с овощами (брокколи, цуккини, эдамаме) с соусом том ям",Горячие блюда,559 с,https://nambafood.kg/dish_image/145490.png
Стейк из форели в сливочно-винном соусе,,Горячие блюда,489 с,https://nambafood.kg/dish_image/145491.png
"Лосось, запеченный под соусом терияки с овощами",,Горячие блюда,999 с,https://nambafood.kg/dish_image/145492.png
Лосось в стиле «Нобу»,"Лосось, пак-чой, дайкон, мисо-карамель.",Горячие блюда,1089 с,https://nambafood.kg/dish_image/64942.png
Палтус с пюре из зеленого горошка,,Горячие блюда,579 с,https://nambafood.kg/dish_image/145493.png
Сяке дон,Обжаренные кусочки нежного лосося с омлетом на рисовой подушке.,Горячие блюда,499 с,https://nambafood.kg/dish_image/70707.png
Тяхан с говядиной,"Рис с кусочками филе говядины, овощами, чесночным соусом и соусом кимчи.",Горячие блюда,419 с,https://nambafood.kg/dish_image/64870.png
Тяхан с курицей,"Рис с кусочками куриного филе, овощами, чесночным соусом и соусом кимчи.",Горячие блюда,369 с,https://nambafood.kg/dish_image/64869.png
Тяхан с креветками,"Рис с кусочками креветок, овощами, чесночным соусом и соусом кимчи.",Горячие блюда,579 с,https://nambafood.kg/dish_image/64872.png
Говядина с рисом,"Жареное мясо говядины в wok с луком, с добавлением соевого уксуса, подается с рисом.",Горячие блюда,629 с,https://nambafood.kg/dish_image/64936.png
Тофу по-домашнему,"С говядиной, брокколи, помидорами черри, чесноком и болгарским перцем.",Горячие блюда,489 с,https://nambafood.kg/dish_image/64966.png
Говядина в тайском стиле,"Жареная говядина с луком, шампиньоны, кешью, подаётся с рисом.",Горячие блюда,489 с,https://nambafood.kg/dish_image/116871.png
Рибай стейк,,Горячие блюда,839 с,https://nambafood.kg/dish_image/104680.png
Ковбой стейк,,Горячие блюда,899 с,https://nambafood.kg/dish_image/104681.png
Нежное филе миньон жареное на гриле,"С микс-салатом, с соусом тар-тар и песто.",Горячие блюда,759 с,https://nambafood.kg/dish_image/104688.png
Биф терияки,"Кусочки говядины, тушенные под соусом терияки, подаются с микс-салатом.",Горячие блюда,649 с,https://nambafood.kg/dish_image/64935.png
Каре аге,"Нежные хрустящие кусочки курицы в остром кляре, в кисло- сладком маринаде.",Горячие блюда,469 с,https://nambafood.kg/dish_image/64940.png
Тори катсу,Куриное филе в хрустящей панировке с сыром моцарелла.,Горячие блюда,499 с,https://nambafood.kg/dish_image/64868.png
Курица Wok с арахисом,"Куриное филе, обжаренное до хрустящей корочки с арахисом, заправленное кисло-сладким соусом.",Горячие блюда,419 с,https://nambafood.kg/dish_image/64861.png
Курица «Тори»,Жареные кусочки курицы в кисло-сладком соусе.,Горячие блюда,419 с,https://nambafood.kg/dish_image/64941.png
Курица Wok с овощами,,Горячие блюда,419 с,https://nambafood.kg/dish_image/104687.png
"Лосось, запеченный под соусом терияки с овощами",,Горячие блюда,999 с,https://nambafood.kg/dish_image/145808.png
Рис отварной,,Гарниры,119 с,https://nambafood.kg/dish_image/7752.png
Гречка,,Гарниры,119 с,https://nambafood.kg/dish_image/64358.png
Картофель фри,,Гарниры,139 с,https://nambafood.kg/dish_image/7753.png
Картофель по-домашнему,,Гарниры,139 с,https://nambafood.kg/dish_image/76959.png
Овощи гриль,,Гарниры,239 с,https://nambafood.kg/dish_image/76961.png
Спайси суши с лососем,"Лосось, спайси соус, зеленый лук.",Гунканы / Спайси суши,189 с,https://nambafood.kg/dish_image/64881.png
Спайси суши с креветкой,"Креветка, спайси соус, зеленый лук.",Гунканы / Спайси суши,189 с,https://nambafood.kg/dish_image/64880.png
Спайси суши с копченым лососем,"Копченый лосось, спайси соус, зеленый лук.",Гунканы / Спайси суши,199 с,https://nambafood.kg/dish_image/64879.png
Спайси суши с угрем,"Угорь, спайси соус, зеленый лук.",Гунканы / Спайси суши,189 с,https://nambafood.kg/dish_image/64882.png
Спайси суши с тунцом,"Тунец, спайси соус, зеленый лук.",Гунканы / Спайси суши,189 с,https://nambafood.kg/dish_image/64883.png
Сашими Креветка,,Сашими,659 с,https://nambafood.kg/dish_image/64958.png
Сашими Лосось,,Сашими,679 с,https://nambafood.kg/dish_image/64959.png
Сашими Тунец,,Сашими,699 с,https://nambafood.kg/dish_image/64960.png
Сашими Угорь,,Сашими,729 с,https://nambafood.kg/dish_image/64961.png
Суши Окунь,,Суши,149 с,https://nambafood.kg/dish_image/64962.png
Суши Томаго,,Суши,149 с,https://nambafood.kg/dish_image/64888.png
Суши Чука,,Суши,159 с,https://nambafood.kg/dish_image/64891.png
Суши Креветка,,Суши,159 с,https://nambafood.kg/dish_image/64886.png
Суши Лосось,,Суши,159 с,https://nambafood.kg/dish_image/64887.png
Суши Угорь,,Суши,179 с,https://nambafood.kg/dish_image/64890.png
Суши Тунец,,Суши,179 с,https://nambafood.kg/dish_image/64889.png
Суши Копченый лосось,,Суши,179 с,https://nambafood.kg/dish_image/64885.png
Суши Икра лосося,,Суши,199 с,https://nambafood.kg/dish_image/64884.png
Суши Тобико,,Суши,159 с,https://nambafood.kg/dish_image/64964.png
Запеченные суши с угрем,"Угорь, розовый соус, унаги соус, кунжут, зеленый лук.",Запеченные суши,219 с,https://nambafood.kg/dish_image/64874.png
Запеченные суши с лососем,"Лосось, розовый соус, унаги соус, кунжут, зеленый лук.",Запеченные суши,219 с,https://nambafood.kg/dish_image/64875.png
Запеченные суши с креветкой,"Креветка, розовый соус, унаги соус, кунжут, зеленый лук.",Запеченные суши,219 с,https://nambafood.kg/dish_image/64876.png
Запеченные суши с тунцом,"Тунец, розовый соус, унаги соус, кунжут, зеленый лук.",Запеченные суши,219 с,https://nambafood.kg/dish_image/64877.png
Ролл с огурцом,,Хосомаки,219 с,https://nambafood.kg/dish_image/64955.png
Ролл с авокадо,,Хосомаки,239 с,https://nambafood.kg/dish_image/64951.png
Ролл с тобико,,Хосомаки,299 с,https://nambafood.kg/dish_image/145822.png
Ролл с креветкой,,Хосомаки,339 с,https://nambafood.kg/dish_image/145820.png
Ролл с омлетом,,Хосомаки,259 с,https://nambafood.kg/dish_image/64956.png
Ролл с икрой лосося,,Хосомаки,449 с,https://nambafood.kg/dish_image/64952.png
Ролл с тунцом,,Хосомаки,399 с,https://nambafood.kg/dish_image/64957.png
Ролл с копченым лососем,,Хосомаки,389 с,https://nambafood.kg/dish_image/64953.png
Ролл с лососем,,Хосомаки,389 с,https://nambafood.kg/dish_image/64954.png
Ролл с угрем,,Хосомаки,439 с,https://nambafood.kg/dish_image/145821.png
Сяке Сандочи,"Авокадо, лосось, угорь, сыр Филадельфия, кунжут.",Роллы,749 с,https://nambafood.kg/dish_image/64985.png
Мисато ролл,"Копченый лосось, авокадо, лук зеленый, тобико.",Роллы,749 с,https://nambafood.kg/dish_image/64898.png
Филадельфия грин,"Лосось, сыр филадельфия, огурец, авокадо.",Роллы,879 с,https://nambafood.kg/dish_image/64987.png
Йоко ролл,"Лосось жареный, сыр филадельфия, тобико, лист салата.",Роллы,639 с,https://nambafood.kg/dish_image/70701.png
Калифорния с лососем,"Лосось, авокадо, японски майонез, огурец, икра тобико.",Роллы,579 с,https://nambafood.kg/dish_image/70703.png
Суши руум,"Лосось, угорь, авокадо, огурец, сыр филадельфия, фирменный соус, кунжут.",Роллы,899 с,https://nambafood.kg/dish_image/64963.png
Чука маки ролл,"Угорь копченый, авокадо, лосось, сыр Филадельфия, чука с ореховым соусом.",Роллы,789 с,https://nambafood.kg/dish_image/64973.png
Филадельфия ролл,"Сыр Филадельфия, лосось.",Роллы,799 с,https://nambafood.kg/dish_image/64988.png
Тамаго ролл,"Ролл из японского омлета с угрем и соусом унаги, кунжут.",Роллы,599 с,https://nambafood.kg/dish_image/64965.png
Калифорния ролл,"Креветки тобико авокадо, огурец, майонез.",Роллы,599 с,https://nambafood.kg/dish_image/64939.png
Унаги ролл,"Угорь копченый, рис, лосось, огурец, сыр Филадельфия.",Роллы,659 с,https://nambafood.kg/dish_image/64970.png
Ролл Сяке темпура,"Семга, тунец, сыр Филадельфия, икра тобико, авокадо, огурцы.",Роллы,879 с,https://nambafood.kg/dish_image/116862.png
Сяке чиз ролл,"Лосось, сыр филадельфия, жарится в кляре.",Роллы,749 с,https://nambafood.kg/dish_image/70704.png
Жареный ролл «Мураками»,"Угорь, семга, креветка, сыр Филадельфия.",Роллы,899 с,https://nambafood.kg/dish_image/116864.png
Хот ролл,"Сыр Филадельфия, тобико, тамаго, угорь, лук зеленый, соус фирменный.",Роллы,649 с,https://nambafood.kg/dish_image/64971.png
Изумитай ролл,"Ролл тигровые креветки, окунь, соус фирменный.",Роллы,489 с,https://nambafood.kg/dish_image/64938.png
Запечённая Филадельфия,"Семга, угорь, сыр филадельфия, соус фирменный.",Роллы,829 с,https://nambafood.kg/dish_image/116874.png
