Наименование,Описание,Категория,Цена,Фото
Блинчики с аппетитной мясной начинкой,3 шт.,Завтраки,170 с,https://nambafood.kg/dish_image/135057.png
Блинчики с творогом,3 шт.,Завтраки,150 с,https://nambafood.kg/dish_image/135058.png
Блинчики с творогом и сладостями,3 шт.,Завтраки,220 с,https://nambafood.kg/dish_image/134208.png
Каша манная,,Завтраки,120 с,https://nambafood.kg/dish_image/141113.png
Каша рисовая,350 гр.,Завтраки,100 с,https://nambafood.kg/dish_image/64207.png
Каша овсяная,350 гр.,Завтраки,120 с,https://nambafood.kg/dish_image/141114.png
Блинчики со сметаной,3 шт.,Завтраки,140 с,https://nambafood.kg/dish_image/141112.png
Ишефс завтрак,"Яйца, тостерный хлеб, арабская пита, помидоры, хумус, огурцы, оливки, халва, сузмо, мед, соус виногр., сыр, чай",Завтраки,500 с,https://nambafood.kg/dish_image/140860.png
Омлет микс,"Яйца, сосиски кур., говяжьи, зелень, листья, сол.огурцы, черри, тостерный хлеб",Завтраки,280 с,https://nambafood.kg/dish_image/134209.png
Омлет с сосисками,"Яйца, сосиски куриные, зелень, листья салата, огурцы, черри, тостерный хлеб",Завтраки,200 с,https://nambafood.kg/dish_image/134210.png
Шакшука,"Яйца, помидоры, перец болгарский, зелень",Завтраки,220 с,https://nambafood.kg/dish_image/134499.png
Фуль Айран,"Бобы, чеснок, огурцы солен., помидоры, айран",Завтраки,380 с,https://nambafood.kg/dish_image/135064.png
Сырники,3 шт.,Завтраки,180 с,https://nambafood.kg/dish_image/135062.png
Боул суши,"Семга копченая, авокадо, свежие огурцы, редиска, нори, кунжут, лимон, икра красная, чеснок, рис, крем чиз",Боулы,420 с,https://nambafood.kg/dish_image/140861.png
Боул с курицей,"Куриная грудка, яйцо, кукуруза, творожный сыр, шпинат, черри, гречка, авокадо",Боулы,310 с,https://nambafood.kg/dish_image/140862.png
Боул с креветками,"Креветки, киноа, айсберг, морковь, перец болг. красный, огурцы свежие, авокадо, соус песто, соус тартар, чеснок",Боулы,400 с,https://nambafood.kg/dish_image/141083.png
Боул с курицей «ПП»‎‎,"Куриная грудка, бургуль, вешенки, помидоры, огурцы, зерн. горчица, авокадо",Боулы,360 с,https://nambafood.kg/dish_image/140863.png
Золотые креветки,,Закуски,400 с,https://nambafood.kg/dish_image/135065.png
Куриные наггетсы,,Закуски,370 с,https://nambafood.kg/dish_image/135066.png
Сырные палочки,150 гр.,Закуски,350 с,https://nambafood.kg/dish_image/135067.png
Кальмары в кольцах,,Закуски,470 с,https://nambafood.kg/dish_image/135068.png
Рыбные палочки,150 гр.,Закуски,350 с,https://nambafood.kg/dish_image/135069.png
Овощное ассорти,"300 гр. Помидоры, огурцы, перец болгарский, зелень, лук, чеснок.",Холодные закуски,260 с,https://nambafood.kg/dish_image/135070.png
Закуски по-русски,"300 гр. Сельдь, картофель, маринованные огурцы, лук.",Холодные закуски,240 с,https://nambafood.kg/dish_image/135466.png
Фруктовая тарелка,"900 гр. Апельсины, киви, банан, грейпфрут, груша, клубника, яблоки",Холодные закуски,380 с,https://nambafood.kg/dish_image/141081.png
Ассорти хрустящее,,Холодные закуски,650 с,https://nambafood.kg/dish_image/135072.png
Изме,"Болгарский перец, помидоры, огурцы, чеснок, лук",Арабские закуски,160 с,https://nambafood.kg/dish_image/140864.png
Хумус,"180 гр. Пюре из нукута, кунжутное масло, лимон, оливковое масло.",Арабские закуски,260 с,https://nambafood.kg/dish_image/134478.png
Сузмо каурма,"Сузмо, мясо говядины, черри. мята, орехи грецкие",Арабские закуски,270 с,https://nambafood.kg/dish_image/134480.png
Сузмо,180 г.,Арабские закуски,180 с,https://nambafood.kg/dish_image/134477.png
Хумус каурма,"Пюре из ноката, мясо говядины, лимон, сок, соус Тахини, масло оливковое",Арабские закуски,350 с,https://nambafood.kg/dish_image/134483.png
Хайдари,"Сузмо, огурцы св. масло оливковое, чеснок, петрушка",Арабские закуски,180 с,https://nambafood.kg/dish_image/134482.png
Хумус со свеклой,"Пюре из ноката, свекла, лимон.соу, соус Тахини, масло оливковое",Арабские закуски,270 с,https://nambafood.kg/dish_image/134479.png
Мутабель,"180 гр. баклажаны, соус Тахини, чеснок, лимон.сок, гранат",Арабские закуски,230 с,https://nambafood.kg/dish_image/134476.png
Язык по-китайски,"300 гр. Язак гов. огурцы, перец болг, кунжут, семечки, соевый соус.",Салаты,300 с,https://nambafood.kg/dish_image/134485.png
Цезарь с курицей,"300 гр. Листья салата, сухарики, куриное филе, сыр Пармезан, помидоры черри, перепелиные яйца, соус ""Цезарь"".",Салаты,320 с,https://nambafood.kg/dish_image/134484.png
Цезарь с креветками,,Салаты,420 с,https://nambafood.kg/dish_image/135073.png
Шакарап,300 гр.,Салаты,190 с,https://nambafood.kg/dish_image/64209.png
Салат Свежий,"300 гр. Свежие огурцы, помидоры, листья салата, красный лук, лимонный сок, оливковое масло.",Салаты,210 с,https://nambafood.kg/dish_image/141084.png
Гватемала,"Баклажаны, помидоры, сыр Пармезан, листья салата, чеснок, майонез",Салаты,340 с,https://nambafood.kg/dish_image/73251.png
Цезарь классический,"Айсберг, сыр пармезан, тостерный хлеб, соус Цезарь",Салаты,220 с,https://nambafood.kg/dish_image/141085.png
Нисуаз,"Яйца, картофель, помидоры, тунец консервированный, фасоль зеленая, маслины, лимон",Салаты,300 с,https://nambafood.kg/dish_image/134486.png
Табуле,"Помидоры, бургуль, лук зеленый, петрушка, лимон, сок и мята, масло оливковое",Салаты,240 с,https://nambafood.kg/dish_image/135074.png
Китайский с говядиной,"300 гр. Говяжий язык, лук, огурцы, помидоры, чеснок, соевый соус.",Салаты,340 с,https://nambafood.kg/dish_image/134227.png
Фатуш,"300 гр. Свежие помидоры, огурцы, перец болгарский, редис, листья салата, репчатый лук, петрушка, зеленый лук, масло оливковое, сухарики, заправка из оливкового масла и гранатового сока.",Салаты,250 с,https://nambafood.kg/dish_image/135075.png
Баклажаны в кисло-сладком соусе,"300 гр. Жареные баклажаны, перчик чили, перчик болгарский, чеснок, кунжут, соевый соус, зелень кинза.",Салаты,300 с,https://nambafood.kg/dish_image/135077.png
Оливье,"300 гр. Картошка, колбаса, морковь, зеленый горошек, яйцо, майонез.",Салаты,260 с,https://nambafood.kg/dish_image/134488.png
Сяке сарада,"Лосось, орехи грецкие, черри, кунжутное масло, листья салата",Салаты,350 с,https://nambafood.kg/dish_image/135076.png
Гриль салат с говядиной,"Говядина, перец болг, цукини, шампиньоны, шпинат, руккола",Салаты,370 с,https://nambafood.kg/dish_image/134230.png
Греческий,"Огурцы, помидоры, листья салата, сыр фета, и лимонный сок, перец, масло оливковое",Салаты,340 с,https://nambafood.kg/dish_image/135078.png
Теплый салат с куриной печенью,,Салаты,240 с,https://nambafood.kg/dish_image/134229.png
Салат «Пияз»‎‎,"Помидоры, огурцы св., фасоль белая, лук красный, гранат. соус, сумак, болг. перец, яйцо отварное,",Салаты,240 с,https://nambafood.kg/dish_image/140867.png
Салат «Витаминка»‎‎,"Свекла отварная, творожный сыр, семена чиа, руккола, шпинат, кедровые орешки, заправка из бальзамика с лимоном и дижонской горчицей",Салаты,300 с,https://nambafood.kg/dish_image/141095.png
Шорпо из говядины,"350 г. Ребра, морковь, картофель, зелень",Супы,250 с,https://nambafood.kg/dish_image/141088.png
Шорпо с бараниной,"Ребра баранина, морковь, картофель, зелень",Супы,250 с,https://nambafood.kg/dish_image/141087.png
Томатный суп,"350 г. Помидоры, соус из помидоров, морковь, чеснок",Супы,200 с,https://nambafood.kg/dish_image/135081.png
Сан-торо,"350 г. Говядина, полу горький перец, чеснок. зелень, перепелиные яйца, фунчоза, чили перец.",Супы,240 с,https://nambafood.kg/dish_image/141089.png
Солянка,"350 гр. Маринованные огурцы, курица копченная, колбаса, помидоры, паста.",Супы,240 с,https://nambafood.kg/dish_image/135515.png
Уха классическая,"350 гр. Форель, судак, овощи, специи",Супы,260 с,https://nambafood.kg/dish_image/105904.png
Уха по-фински,"Семга, форель, овощи, сливки, картофель, морковь, специи",Супы,350 с,https://nambafood.kg/dish_image/140865.png
Суп из шпината,,Супы,160 с,https://nambafood.kg/dish_image/134492.png
Суп из брокколи,,Супы,170 с,https://nambafood.kg/dish_image/134493.png
Мерджимек,,Супы,180 с,https://nambafood.kg/dish_image/134494.png
Грибной крем-суп,350 гр. Из шампиньонов со сливками,Супы,190 с,https://nambafood.kg/dish_image/135080.png
Келе пача,350 гр. Крем суп из головы барашка,Супы,280 с,https://nambafood.kg/dish_image/134329.png
Пельмени со сметаной,"350 гр.  Пельмени, бульон, сметана.",Супы,180 с,https://nambafood.kg/dish_image/135083.png
Пельмени в айране,350 гр.,Супы,200 с,https://nambafood.kg/dish_image/135082.png
Окрошка,"350 гр. Колбаса докт. яйца, картофель, огурцы, зелень, редис.",Супы,180 с,https://nambafood.kg/dish_image/135516.png
Товук,350 гр. Куриный суп,Супы,180 с,https://nambafood.kg/dish_image/135084.png
Шакрия с говядиной,"350 гр. Говядина, рис пилав, кедровые орешки, соус из густого йогурта, зелень.",Арабские Горячие блюда,430 с,https://nambafood.kg/dish_image/135085.png
Шакрия с бараниной,"250 гр. Кисло-молочный соус, баранина, гарнир, рис.",Арабские Горячие блюда,400 с,https://nambafood.kg/dish_image/135086.png
Шакрия с курицей,300 гр. Куриное филе с рисом в айране,Арабские Горячие блюда,380 с,https://nambafood.kg/dish_image/135087.png
Фалафель,"7 шт. Вегетарианские котлетки из ноката, соус тартар, помидоры, листья салата",Арабские Горячие блюда,190 с,https://nambafood.kg/dish_image/135092.png
Кеббе,"4 шт. Фарш говяжий, листья салата, черри",Арабские Горячие блюда,290 с,https://nambafood.kg/dish_image/134498.png
Яланджи,"9 шт. Виноградные листья, гранат, помидоры, рис, перец паста",Арабские Горячие блюда,350 с,https://nambafood.kg/dish_image/135091.png
Кафта с помидорами,"Фарш, помидоры, лук репч., картофель отварной, томатная паста",Арабские Горячие блюда,360 с,https://nambafood.kg/dish_image/140866.png
Фалафель сэндвич,"Хумус, помидоры, редиска, огурцы солен., лаваш",Арабские Горячие блюда,200 с,https://nambafood.kg/dish_image/140868.png
Острая картошка,"Картофель, чеснок, кинза, красный острый перец, лимонный сок.",Арабские Горячие блюда,140 с,https://nambafood.kg/dish_image/135088.png
Фатта с мясом,"Говядина донер, лаваш дурум, рис инд., соус фатта",Арабские Горячие блюда,430 с,https://nambafood.kg/dish_image/135089.png
Фатта с курицей,"Курица донер, лаваш дурум, рис инд., соус фатта",Арабские Горячие блюда,380 с,https://nambafood.kg/dish_image/135090.png
Самбурсак,"5 шт. Самбурсак с мясом, листья салата, черри",Арабские Горячие блюда,240 с,https://nambafood.kg/dish_image/134497.png
Самбурсак со шпинатом,"5 шт. Жареные пирожки со шпинатом, лимон",Арабские Горячие блюда,180 с,https://nambafood.kg/dish_image/134335.png
Еш ал бул-бол,"5 шт. Фарш, гранат, гранатовый соус, слоеное тесто, кедровые орехи, лимон, маслины",Арабские Горячие блюда,250 с,https://nambafood.kg/dish_image/134334.png
Маза,"Фатуш, хумус, мутабель, сузме, табуле",Арабские Горячие блюда,520 с,https://nambafood.kg/dish_image/140871.png
Самбурсак с сыром,5 шт. Жареные пирожки с сыром,Арабские Горячие блюда,190 с,https://nambafood.kg/dish_image/141090.png
Манты,5 шт.,Вторые блюда,250 с,https://nambafood.kg/dish_image/135095.png
Куурдак из говядины,300 гр.,Вторые блюда,400 с,https://nambafood.kg/dish_image/135096.png
Лагман,350 гр.,Вторые блюда,270 с,https://nambafood.kg/dish_image/135097.png
Куурдак из баранины,300 гр.,Вторые блюда,420 с,https://nambafood.kg/dish_image/135098.png
Гюро лагман,350 гр.,Вторые блюда,270 с,https://nambafood.kg/dish_image/135099.png
Босо лагман,350 гр.,Вторые блюда,270 с,https://nambafood.kg/dish_image/135100.png
Мясо на жаровне,"350 гр. Говядина, помидоры, болгарский перец, репчатый лук, соевый соус, специи.",Блюда из мяса,350 с,https://nambafood.kg/dish_image/135101.png
Бефстроганов с пюре,350 гр. Маринованная говядина на подушке из пюре с маринованными огурцами.,Блюда из мяса,370 с,https://nambafood.kg/dish_image/12554.png
Мясо по-французски,"350 гр. Говядина, грибы вешенки, картофель, помидоры, репчатый лук, майонез, сыр.",Блюда из мяса,370 с,https://nambafood.kg/dish_image/135102.png
Говядина терияки,"Говядина, черри, перец болг., соус Терияки, рис плов",Блюда из мяса,340 с,https://nambafood.kg/dish_image/134239.png
Бон филе по-итальянски,"Бон филе, спагетти, черри, пармезан, соус Базилик",Блюда из мяса,520 с,https://nambafood.kg/dish_image/135103.png
Сач каурма,"300 гр. Говядина, болгарский перец, помидоры, картофель фри, сузме, рис пилав.",Блюда из мяса,380 с,https://nambafood.kg/dish_image/135104.png
Мясо в горшочке,"Говядина, вешенки, сулугуни, картофель, майонез",Блюда из мяса,370 с,https://nambafood.kg/dish_image/135105.png
Сач-тава,"300 гр. Говядина, грибы вешенки, помидоры, болгарский перец, репчатый лук, рис пилав.",Блюда из мяса,380 с,https://nambafood.kg/dish_image/135519.png
Пиката из курицы,"Куриная грудинка, черри, гранатовый соус, цукини, морковь, шампиньоны, брокколи, фри",Блюда из птицы,360 с,https://nambafood.kg/dish_image/140869.png
Курица на жаровне,"350 гр. Куриная грудка, болгарский перец, лук, помидоры, соевый соус.",Блюда из птицы,330 с,https://nambafood.kg/dish_image/135106.png
Куриная печень,"Кур. печень, чеснок, чесночный соус, гранатовый соус",Блюда из птицы,250 с,https://nambafood.kg/dish_image/134240.png
Цыпленок на гриле в чесночном соусе,"Цыпленок, кртофель, перец болгарский, цукини, черри, шампиньоны, чесночный соус",Блюда из птицы,580 с,https://nambafood.kg/dish_image/135107.png
Фрикасе из курицы,"300 гр. Куриная грудка, лук репчатый, кукуруза, плавленый сыр, сливки, вешенки.",Блюда из птицы,350 с,https://nambafood.kg/dish_image/134336.png
Курица карри,"Куриная грудка, соус карри, рис",Блюда из птицы,350 с,https://nambafood.kg/dish_image/135111.png
Эскалоп миланьеза,,Блюда из птицы,390 с,https://nambafood.kg/dish_image/135113.png
Филе семги,"Черри, пюре, зелень, соус шафран, гарнир из шпината",Рыба,850 с,https://nambafood.kg/dish_image/134242.png
Рыба на жаровне,"350 гр. Филе судака, болгарский перец, лук репчатый, чеснок, помидоры.",Рыба,330 с,https://nambafood.kg/dish_image/134340.png
Стейк из семги,"Черри, запеченные овощи, зелень, соус шафран, гарнир из шпината, икра красная",Рыба,850 с,https://nambafood.kg/dish_image/134338.png
Филе форели,"Форель, черри, запеченная картошка, зелень, соус бринесс",Рыба,520 с,https://nambafood.kg/dish_image/134339.png
Рыба по-китайски,"350 гр. Филе судака, болгарский перец, лук репчатый, соус вакаме.",Рыба,340 с,https://nambafood.kg/dish_image/134341.png
Запеченная картошка,,Гарниры,150 с,https://nambafood.kg/dish_image/134342.png
Картофель фри,150 гр.,Гарниры,140 с,https://nambafood.kg/dish_image/134346.png
Рис «Пилав»‎‎,150 гр.,Гарниры,90 с,https://nambafood.kg/dish_image/12576.png
Овощи гриль,250 гр. Овощи по сезону,Гарниры,160 с,https://nambafood.kg/dish_image/134343.png
Картофель «Кантри»‎‎,"Картофель, перец болгарский",Гарниры,150 с,https://nambafood.kg/dish_image/134244.png
Овощи на пару,,Гарниры,140 с,https://nambafood.kg/dish_image/134344.png
Адана кебаб острый,"Шашлык из фарша, запеченные овощи, рис пилав, салат биваз",Шашлыки,370 с,https://nambafood.kg/dish_image/135520.png
Урфа кебаб,Шашлык из фарша не острый.,Шашлыки,420 с,https://nambafood.kg/dish_image/135115.png
Антабли,"Шашлык из фарша, запеченные овощи, рис пилав, салат биваз, фри",Шашлыки,350 с,https://nambafood.kg/dish_image/134246.png
Чикен таук с сыром,,Шашлыки,350 с,https://nambafood.kg/dish_image/134348.png
Форель на решетке,250 гр. С овощами гриль по сезону,Шашлыки,420 с,https://nambafood.kg/dish_image/140870.png
Сарма с фисташками,"Шашлык из фарша в лаваше с сыром сулугуни, запеченные овощи, салат по сезону, соус бейти, фисташки",Шашлыки,430 с,https://nambafood.kg/dish_image/140872.png
Бейти сарма,"Шышлык из фарша в лаваше, рис пилав, огурцы, помидоры, соус",Шашлыки,430 с,https://nambafood.kg/dish_image/134349.png
Араис,"Шашлык из фарша в лаваше, салат биваз, хумус",Шашлыки,330 с,https://nambafood.kg/dish_image/134350.png
Сарма кебаб,"Шашлык из фарша в лаваше, запеченные овощи, рис пилав, салат биваз, соус",Шашлыки,420 с,https://nambafood.kg/dish_image/134351.png
Ишефс сарма,"Шашлык из фарша с сыром в лаваше, салат биваз, сарма соус",Шашлыки,400 с,https://nambafood.kg/dish_image/135117.png
Кафта с сыром,"Шашлык из фарша на лепешке, перец полуг., черри, лук, лимон, соус, сыр сулугуни",Шашлыки,430 с,https://nambafood.kg/dish_image/135118.png
Кафта с сыром большая,"Шашлык из фарша на лепешке, перец полуг., черри, лук, лимон, соус, сыр сулугуни",Шашлыки,750 с,https://nambafood.kg/dish_image/135119.png
Чикен таук,"Окорочка, запеченные овощи, салат биваз, фри, чесночный соус",Шашлыки,370 с,https://nambafood.kg/dish_image/134353.png
Куриное барбекю,,Шашлыки,900 с,https://nambafood.kg/dish_image/134354.png
Бараньи ребра,"Запеченные овощи, салат биваз, соус",Шашлыки,610 с,https://nambafood.kg/dish_image/135120.png
Куриные крылышки,"Запеченные овощи. салат биваз. фри, чесночный соус",Шашлыки,300 с,https://nambafood.kg/dish_image/135121.png
Баранина с жиром,"Запеченные овощи, салат биваз, соус, рис пилав",Шашлыки,470 с,https://nambafood.kg/dish_image/134358.png
Бон филе с жиром,,Шашлыки,550 с,https://nambafood.kg/dish_image/134252.png
Кафта с баклажанами,"Шашлык из фарша с баклажанами, запеченные овощи, рис пилав, салат биваз, фри, соус",Шашлыки,460 с,https://nambafood.kg/dish_image/134355.png
Шашлык ассорти,"Люля кебаб, баранина, крылышки, бар.ребра, чикен таук, запеченные овощи, морковный салат, рис пилав, соус",Шашлыки,590 с,https://nambafood.kg/dish_image/134357.png
