Наименование,Описание,Категория,Цена,Фото
A2 Жареная цветная капуста,300 г,Фирменные блюда,380 с,https://nambafood.kg/dish_image/81183.png
A3 Бараньи ребра в чесночном соусе,400 г,Фирменные блюда,990 с,https://nambafood.kg/dish_image/81254.png
A5 Бараньи ребра с картошкой,800 г,Фирменные блюда,990 с,https://nambafood.kg/dish_image/81185.png
A6 Дан пан джи,800 г,Фирменные блюда,710 с,https://nambafood.kg/dish_image/81285.png
A8 Жареная баранья печень с луком,300 г,Фирменные блюда,410 с,https://nambafood.kg/dish_image/81188.png
А11 Жареная говядина с пампушкой,300 г,Фирменные блюда,430 с,https://nambafood.kg/dish_image/80828.png
А12 Жареная баранья печень с острым перцем,300 г,Фирменные блюда,410 с,https://nambafood.kg/dish_image/80500.png
А13 Жареная капуста,300 г,Фирменные блюда,300 с,https://nambafood.kg/dish_image/81286.png
А14 Жареный перец с баклажаном,300 г,Фирменные блюда,320 с,https://nambafood.kg/dish_image/81287.png
А15 Хрустящая курица в пряно-остром соусе,300 г,Фирменные блюда,580 с,https://nambafood.kg/dish_image/80829.png
A19 Хрустящие бараньи ребра,400 г,Фирменные блюда,990 с,https://nambafood.kg/dish_image/81263.png
B1 Вареная говядина в остром соусе,250 г,Холодные закуски,440 с,https://nambafood.kg/dish_image/81264.png
B3 Морская капуста в чесночном соусе,250 г,Холодные закуски,310 с,https://nambafood.kg/dish_image/80406.png
B4 Домашняя курица в пряно-остром соусе,250 г,Холодные закуски,890 с,https://nambafood.kg/dish_image/80507.png
B5 Черная фунчеза в кисло-остром соусе,250 г,Холодные закуски,320 с,https://nambafood.kg/dish_image/80410.png
B7 Огурцы в чесночном соусе,250 г,Холодные закуски,300 с,https://nambafood.kg/dish_image/80396.png
B8 Черные яйца с зеленым перцем,250 г,Холодные закуски,420 с,https://nambafood.kg/dish_image/80412.png
В10 Ароматная говядина,250 г,Холодные закуски,440 с,https://nambafood.kg/dish_image/80512.png
В11 Шпинат в имбирном соусе,250 г,Холодные закуски,320 с,https://nambafood.kg/dish_image/80403.png
B12 Золотые грибы со шпинатом,250 г,Холодные закуски,330 с,https://nambafood.kg/dish_image/80510.png
B14 Ароматно-золотые грибы,250 г,Холодные закуски,340 с,https://nambafood.kg/dish_image/80404.png
В15 Жареный арахис,250 г,Холодные закуски,320 с,https://nambafood.kg/dish_image/80513.png
B17 Огурцы и помидоры в чесночном соусе,250 г,Холодные закуски,300 с,https://nambafood.kg/dish_image/80407.png
В19 Брокколи в чесночном соусе,250 г,Холодные закуски,330 с,https://nambafood.kg/dish_image/81288.png
В20 Смесь с грибами,250 г,Холодные закуски,330 с,https://nambafood.kg/dish_image/81266.png
В21 Язык в красном соусе,250 г,Холодные закуски,440 с,https://nambafood.kg/dish_image/81284.png
В22 Язык с огурцами,250 г,Холодные закуски,440 с,https://nambafood.kg/dish_image/80516.png
В23 Язык с курицей и зеленым перцем,250 г,Холодные закуски,430 с,https://nambafood.kg/dish_image/81283.png
В25 Курица в чесночном соусе,250 г,Холодные закуски,430 с,https://nambafood.kg/dish_image/80520.png
В26 Хрустящая мойва,250 г,Холодные закуски,410 с,https://nambafood.kg/dish_image/80408.png
В27 Куриная соломка и говядина с зеленым перцем,250 г,Холодные закуски,430 с,https://nambafood.kg/dish_image/80521.png
В28 Черные грибы с луком,250 г,Холодные закуски,340 с,https://nambafood.kg/dish_image/80420.png
B30 Спаржа с овощами,250 г,Холодные закуски,330 с,https://nambafood.kg/dish_image/80401.png
В31 Требуха в кисло-остром соусе,250 г,Холодные закуски,420 с,https://nambafood.kg/dish_image/80416.png
В33 Говядина с маринованными огурцами,250 г,Холодные закуски,440 с,https://nambafood.kg/dish_image/80409.png
В34 Баклажан в кисло-сладком соусе,250 г,Холодные закуски,330 с,https://nambafood.kg/dish_image/81282.png
С4 Картофель ганьго,300 г,Горячие блюда,320 с,https://nambafood.kg/dish_image/81280.png
С5 Курица ганьго,300 г,Горячие блюда,490 с,https://nambafood.kg/dish_image/80374.png
С7 Говядина с требухой ганьго,300 г,Горячие блюда,590 с,https://nambafood.kg/dish_image/81279.png
С8 Тофу по-сычуански,300 г,Горячие блюда,330 с,https://nambafood.kg/dish_image/80529.png
С9 Креветки на жаровне,300 г,Горячие блюда,1080 с,https://nambafood.kg/dish_image/81278.png
С10 Говядина на жаровне,300 г,Горячие блюда,410 с,https://nambafood.kg/dish_image/80365.png
С11 Баклажан на жаровне,300 г,Горячие блюда,320 с,https://nambafood.kg/dish_image/81277.png
С12 Фунчеза на жаровне,300 г,Горячие блюда,320 с,https://nambafood.kg/dish_image/80419.png
С13 Жареные куриные крылышки на шпашках,300 г,Горячие блюда,640 с,https://nambafood.kg/dish_image/80531.png
С14 Кальмары на жаровне,300 г,Горячие блюда,880 с,https://nambafood.kg/dish_image/80532.png
Жареная фасоль в кляре,,Горячие блюда,380 с,https://nambafood.kg/dish_image/83989.png
D1 Жареные креветки с хрустящим перцем,300 г,Блюда из рыбы и морепродуктов,1080 с,https://nambafood.kg/dish_image/80379.png
D2 Креветки с солью и перцем,300 г,Блюда из рыбы и морепродуктов,990 с,https://nambafood.kg/dish_image/80380.png
D3 Жареные брокколи с кальмаром,300 г,Блюда из рыбы и морепродуктов,880 с,https://nambafood.kg/dish_image/80417.png
D6 Жареные креветки завернутые в фольгу,300 г,Блюда из рыбы и морепродуктов,1080 с,https://nambafood.kg/dish_image/80534.png
Е4 Филе рыбы с черными грибами,300 г,Блюда из рыбы и морепродуктов,410 с,https://nambafood.kg/dish_image/80535.png
Е5 Филе рыбы в кисло-сладком соусе,300 г,Блюда из рыбы и морепродуктов,410 с,https://nambafood.kg/dish_image/80369.png
Е6 Жареная рыба с говяжьим фаршем,800 г. Целая рыба,Блюда из рыбы и морепродуктов,780 с,https://nambafood.kg/dish_image/80536.png
Е7 Хрустящая жареная рыба,300 г,Блюда из рыбы и морепродуктов,780 с,https://nambafood.kg/dish_image/80363.png
Е8 Судак в кисло-сладком соусе без костей,800 г,Блюда из рыбы и морепродуктов,850 с,https://nambafood.kg/dish_image/81398.png
Е9 Судак в кисло-остром соусе без костей,800 г,Блюда из рыбы и морепродуктов,850 с,https://nambafood.kg/dish_image/80538.png
F1 Жареная говядина со спаржей,300 г,Блюда из говядины,410 с,https://nambafood.kg/dish_image/81276.png
F2 Жареная говядина с зеленым перцем,300 г,Блюда из говядины,410 с,https://nambafood.kg/dish_image/80360.png
F3 Жареная говядина со стрелочками чеснока,300 г,Блюда из говядины,410 с,https://nambafood.kg/dish_image/80353.png
F4 Шашлык по-китайски,300 г,Блюда из говядины,450 с,https://nambafood.kg/dish_image/81289.png
F5 Жареная говядина с черными грибами,300 г,Блюда из говядины,410 с,https://nambafood.kg/dish_image/80364.png
F6 Жареная говядина с грибами,300 г,Блюда из говядины,410 с,https://nambafood.kg/dish_image/81274.png
F7 Жареная говядина с блинчиками,300 г,Блюда из говядины,430 с,https://nambafood.kg/dish_image/80351.png
F8 Говядина соломкой с зеленым перцем,300 г,Блюда из говядины,410 с,https://nambafood.kg/dish_image/80350.png
F9 Жареная говядина с бамбуком,300 г,Блюда из говядины,410 с,https://nambafood.kg/dish_image/80349.png
F10 Жареная говядина с острым перцем,300 г,Блюда из говядины,440 с,https://nambafood.kg/dish_image/81273.png
F11 Жареная цветная капуста с говядиной,300 г,Блюда из говядины,410 с,https://nambafood.kg/dish_image/80362.png
F12 Жареная требуха с зеленым перцем,300 г,Блюда из говядины,410 с,https://nambafood.kg/dish_image/80542.png
F13 Жареный говяжий язык,300 г,Блюда из говядины,410 с,https://nambafood.kg/dish_image/80543.png
F14 Жареная говядина с перцем,300 г,Блюда из говядины,410 с,https://nambafood.kg/dish_image/80544.png
F15 Жареная говядина с овощами,300 г. С черными грибами с бамбуком говядиной и луком.,Блюда из говядины,410 с,https://nambafood.kg/dish_image/80358.png
F16 Жареная говядина в кисло-сладком соусе,300 г,Блюда из говядины,410 с,https://nambafood.kg/dish_image/80348.png
F17 Мясо по-сычуаньски,300 г,Блюда из говядины,410 с,https://nambafood.kg/dish_image/80545.png
F18 Вареная говядина в пряно-остром соусе,400 г,Блюда из говядины,520 с,https://nambafood.kg/dish_image/80413.png
F19 Вареная говядина в пряно кислом соусе,400 г,Блюда из говядины,600 с,https://nambafood.kg/dish_image/81178.png
F20 Говядина с джусаем,300 г,Блюда из говядины,470 с,https://nambafood.kg/dish_image/81180.png
F21 Говядина с грибами,300 г,Блюда из говядины,410 с,https://nambafood.kg/dish_image/81181.png
G1 Жареная баранина с луком,300 г,Блюда из баранины,440 с,https://nambafood.kg/dish_image/80366.png
G2 Шашлык из баранины,300 г,Блюда из баранины,450 с,https://nambafood.kg/dish_image/81290.png
G3 Жареная баранина с блинчиками,300 г,Блюда из баранины,430 с,https://nambafood.kg/dish_image/81399.png
G4 Жареная баранина с перцем,300 г,Блюда из баранины,410 с,https://nambafood.kg/dish_image/80368.png
G5 Тушеные ребра с лепешкой,300 г,Блюда из баранины,880 с,https://nambafood.kg/dish_image/81272.png
G6 Бараньи ребра в кляре,300 г,Блюда из баранины,990 с,https://nambafood.kg/dish_image/80548.png
G8 Баранина с овощами,300 г,Блюда из баранины,410 с,https://nambafood.kg/dish_image/80550.png
S1 Курица по-домашнему,300 г,Блюда из курицы,410 с,https://nambafood.kg/dish_image/81271.png
S2 Филе куриное с зеленым перцем,300 г,Блюда из курицы,410 с,https://nambafood.kg/dish_image/81270.png
S3 Филе куриное с черными грибами,300 г,Блюда из курицы,410 с,https://nambafood.kg/dish_image/81269.png
S7 Филе куриное с бамбуком,300 г,Блюда из курицы,410 с,https://nambafood.kg/dish_image/81292.png
S8 Филе куриное в кисло-сладком соусе,300 г,Блюда из курицы,410 с,https://nambafood.kg/dish_image/80556.png
S9 Курица в кляре,300 г,Блюда из курицы,550 с,https://nambafood.kg/dish_image/81268.png
S10 Филе курицы в кисло-остром соусе,300 гр.,Блюда из курицы,410 с,https://nambafood.kg/dish_image/86138.png
K4 Жареный помидор с яйцом,300 г,Блюда с овощами,320 с,https://nambafood.kg/dish_image/81293.png
K5 Жареный баклажан в соевом соусе,300 г,Блюда с овощами,330 с,https://nambafood.kg/dish_image/80426.png
K6 Жареный шпинат,300 г,Блюда с овощами,330 с,https://nambafood.kg/dish_image/80558.png
K7 Баклажан по-домашнему,300 г,Блюда с овощами,330 с,https://nambafood.kg/dish_image/80559.png
K8 Жареный бамбук с перцем,300 г,Блюда с овощами,340 с,https://nambafood.kg/dish_image/81294.png
K9 Жареная капуста с фунчезой,300 г,Блюда с овощами,330 с,https://nambafood.kg/dish_image/80560.png
K10 Картофель соломкой в кисло-остром соусе,300 г,Блюда с овощами,290 с,https://nambafood.kg/dish_image/80423.png
K11 Жареный джусай с яйцом,300 г,Блюда с овощами,300 с,https://nambafood.kg/dish_image/80425.png
K12 Жареные грибы с зеленым перцем,300 г,Блюда с овощами,350 с,https://nambafood.kg/dish_image/80562.png
K13 Жареный фасоль в кляре,300 г,Блюда с овощами,380 с,https://nambafood.kg/dish_image/80563.png
K14 Туфу по-домашнему,300 г,Блюда с овощами,330 с,https://nambafood.kg/dish_image/80564.png
K15 Туфу в пряно-остром соусе,300 г,Блюда с овощами,320 с,https://nambafood.kg/dish_image/81295.png
L1 Суп из домашней курицы и грибами,800 г,Супы,1080 с,https://nambafood.kg/dish_image/80570.png
L2 Кисло острый суп с говядиной,800 г,Супы,300 с,https://nambafood.kg/dish_image/80571.png
L3 Суп туфу и овощи,800 г,Супы,280 с,https://nambafood.kg/dish_image/80572.png
L4 Суп с помидором и яйцом,800 г,Супы,290 с,https://nambafood.kg/dish_image/80375.png
L5 Суп с кукурузой,800 г,Супы,260 с,https://nambafood.kg/dish_image/81297.png
L6 Суп говяжий фарш с крахмалом,800 г,Супы,260 с,https://nambafood.kg/dish_image/80376.png
L7 Суп с фрикадельками,800 г,Супы,680 с,https://nambafood.kg/dish_image/81296.png
M1 Пампушка,1 шт.,Гарниры,40 с,https://nambafood.kg/dish_image/80386.png
M2 Картофель фри,1 порция,Гарниры,130 с,https://nambafood.kg/dish_image/80387.png
M3 Лепешка,1 шт.,Гарниры,50 с,https://nambafood.kg/dish_image/80388.png
M4 Жареный рис с яйцом,1 порция,Гарниры,130 с,https://nambafood.kg/dish_image/80384.png
M5 Отварной рис,1 порция,Гарниры,60 с,https://nambafood.kg/dish_image/80385.png
