Наименование,Описание,Категория,Цена,Фото
A3  Утиное мясо в чесночном соусе,260 г,Салаты,445 с,https://nambafood.kg/dish_image/65767.png
A6  Говядина с огурцами,300g,Салаты,445 с,https://nambafood.kg/dish_image/65768.png
A9 Говяжий язык,300g,Салаты,495 с,https://nambafood.kg/dish_image/65769.png
A12 Требуха в масле чили,300g,Салаты,420 с,https://nambafood.kg/dish_image/65770.png
A14 Черная фунчоза,300g,Салаты,375 с,https://nambafood.kg/dish_image/65772.png
A15	Черные грибы с луком,300g,Салаты,335 с,https://nambafood.kg/dish_image/65773.png
A18	Грибы «золотые нити» в остром соусе,200g,Салаты,375 с,https://nambafood.kg/dish_image/65774.png
A19 Шпинат с тонкими фунчозами,200g,Салаты,335 с,https://nambafood.kg/dish_image/65775.png
A21	 Шпинат в имбирно-соевом соусе,240 г,Салаты,335 с,https://nambafood.kg/dish_image/65777.png
A20 Шпинат с грибами,200g,Салаты,335 с,https://nambafood.kg/dish_image/65776.png
A25 Острая курица «Жомажи»,600g,Салаты,910 с,https://nambafood.kg/dish_image/65778.png
A26	Баклажаны в чесночном соусе,240g,Салаты,335 с,https://nambafood.kg/dish_image/65779.png
A27	 Огурцы в чесночном соусе,300g,Салаты,325 с,https://nambafood.kg/dish_image/65780.png
A29	Шпинат с арахисом,200g,Салаты,335 с,https://nambafood.kg/dish_image/65781.png
A32	Брокколи в чесночном соусе,260g,Салаты,345 с,https://nambafood.kg/dish_image/65782.png
A33 Огурцы с помидорами в соевом соусе,300g,Салаты,310 с,https://nambafood.kg/dish_image/65783.png
A34 Крахмал (Лянфэнь),260g,Салаты,275 с,https://nambafood.kg/dish_image/65784.png
A38 Спаржа с огурцами,300g,Салаты,330 с,https://nambafood.kg/dish_image/65785.png
A39 Холодный маш в соусе,260g,Салаты,275 с,https://nambafood.kg/dish_image/65786.png
A41	Холодный шинкованный картофель в соусе,260g,Салаты,275 с,https://nambafood.kg/dish_image/65788.png
B6  Кисло-острый суп с фунчезой,800 г,Супы,360 с,https://nambafood.kg/dish_image/65789.png
В1 Куриный бульон со сморчоками,1000 г,Супы,1980 с,https://nambafood.kg/dish_image/123820.png
B2 Китайский куриный суп с косточками,2000 г,Супы,1800 с,https://nambafood.kg/dish_image/123826.png
B3 Куриный бульон с грибами,2000 г,Супы,1880 с,https://nambafood.kg/dish_image/123827.png
B4 Куриный бульон с морскими гребешками и с бамбуковыми,2000 г,Супы,1800 с,https://nambafood.kg/dish_image/123828.png
В5 Куриный бульон с морским гребешками (порция),,Супы,450 с,https://nambafood.kg/dish_image/123829.png
В10 Суп с яйцом и морскими водорослями,800 г,Супы,305 с,https://nambafood.kg/dish_image/123830.png
B11 Суп с помидорами и яйцом,800 г,Супы,305 с,https://nambafood.kg/dish_image/123831.png
C4 Говядина соломкой в рыбном соусе,300 г,Говядина,465 с,https://nambafood.kg/dish_image/65794.png
С5 Домашняя жареная говядина,300 г,Говядина,465 с,https://nambafood.kg/dish_image/65795.png
C6 Жареная говядина с джусаем,300 г,Говядина,465 с,https://nambafood.kg/dish_image/65796.png
C7 Говядина соломкой с острым перцем,300 г,Говядина,480 с,https://nambafood.kg/dish_image/65797.png
C9 Говядина в кисло-сладком соусе,300 г,Говядина,455 с,https://nambafood.kg/dish_image/65799.png
C8 Говядина с грибами,300 г,Говядина,475 с,https://nambafood.kg/dish_image/65798.png
C10	Говядина в кисло-остром соусе,300 г,Говядина,455 с,https://nambafood.kg/dish_image/65817.png
C11 Говядина с сельдереем,300 г,Говядина,455 с,https://nambafood.kg/dish_image/65801.png
C12 Говядина с бамбуком,300 г,Говядина,475 с,https://nambafood.kg/dish_image/65802.png
C13 Говядина с овощами в соусе чили,350 г,Говядина,565 с,https://nambafood.kg/dish_image/65803.png
C14 Говядина с овощами,300 г,Говядина,465 с,https://nambafood.kg/dish_image/65804.png
C15	Говядина с чесночными стрелками,300 г,Говядина,475 с,https://nambafood.kg/dish_image/65805.png
C16 Говядина со спаржей,300 г,Говядина,465 с,https://nambafood.kg/dish_image/65806.png
C17 Говядина с черными грибами,300 г,Говядина,465 с,https://nambafood.kg/dish_image/65807.png
C18 Говядина на жаровне,300 г,Говядина,465 с,https://nambafood.kg/dish_image/65808.png
C21 Жареные кусочки говядины с перцем и пампушками,300 г,Говядина,575 с,https://nambafood.kg/dish_image/65809.png
C22	Говядина в самоваре,350 г,Говядина,665 с,https://nambafood.kg/dish_image/65810.png
C23	Смешанная говядина,400 г,Говядина,565 с,https://nambafood.kg/dish_image/65811.png
C24 Сушеный соевый творог с говядиной,300 г,Говядина,455 с,https://nambafood.kg/dish_image/65812.png
C26 Говядина с капустой и фунчозой,400 г,Говядина,535 с,https://nambafood.kg/dish_image/65813.png
C27 Жареная говяжая требуха,300 г,Говядина,495 с,https://nambafood.kg/dish_image/65814.png
C30 Говядина нарезанная соломкой с перцем,300 г,Говядина,455 с,https://nambafood.kg/dish_image/65815.png
C31 Голубцы с перцем по-китайски,300 г,Говядина,575 с,https://nambafood.kg/dish_image/65816.png
D2 Жареные бараньи ребра,500 г.,Баранина,1020 с,https://nambafood.kg/dish_image/65818.png
D3 Ребра баранины в самоваре,500 г,Баранина,1020 с,https://nambafood.kg/dish_image/65819.png
D4 Тушеные бараньи ребра,500 г,Баранина,1020 с,https://nambafood.kg/dish_image/65820.png
D5 Дапанджи из бараньих ребер,800 г,Баранина,990 с,https://nambafood.kg/dish_image/65821.png
D6 Жареная баранина с перцем,300 г,Баранина,455 с,https://nambafood.kg/dish_image/65822.png
D7 Жареная баранина с луком,300 г,Баранина,455 с,https://nambafood.kg/dish_image/65823.png
D8 Баранина в кисло-сладком соусе,300 г,Баранина,455 с,https://nambafood.kg/dish_image/65824.png
D9 Баранина в кисло-остром соусе,300 г,Баранина,455 с,https://nambafood.kg/dish_image/65825.png
D10 Баранина с перцем,300 г,Баранина,465 с,https://nambafood.kg/dish_image/65826.png
D11 Шашлык из баранины по-китайски,300 г,Баранина,480 с,https://nambafood.kg/dish_image/65827.png
D13 Жареная говядина с блинчиками,300 г,Баранина,475 с,https://nambafood.kg/dish_image/65828.png
D14 Баранина на жаровне,300 г,Баранина,455 с,https://nambafood.kg/dish_image/65829.png
E1 Жареная «Рыба-виноград» в кисло-остром соусе,600 г,Морепродукты,910 с,https://nambafood.kg/dish_image/65830.png
E2 Жареная «Рыба-виноград» в кисло-сладком соусе,600 г,Морепродукты,910 с,https://nambafood.kg/dish_image/65831.png
E3 Рыба кусочками в кисло-остром соусе,300 г,Морепродукты,455 с,https://nambafood.kg/dish_image/65832.png
E4 Рыба кусочками в кисло-сладком соусе,300 г,Морепродукты,455 с,https://nambafood.kg/dish_image/65833.png
E5 Хрустящая рыба в кляре,10 шт.,Морепродукты,465 с,https://nambafood.kg/dish_image/65834.png
E6 Жареная мойва,10 шт.,Морепродукты,465 с,https://nambafood.kg/dish_image/65835.png
E16 Рыба кусочками на жаровне,300 г,Морепродукты,455 с,https://nambafood.kg/dish_image/65837.png
F1 Курица по-гунбао,300 г,Блюда из птицы,445 с,https://nambafood.kg/dish_image/65841.png
F2 Курица с перцем,300 г,Блюда из птицы,455 с,https://nambafood.kg/dish_image/65842.png
F3 Курица в кисло-сладком соусе,300 г,Блюда из птицы,445 с,https://nambafood.kg/dish_image/65843.png
F4 Курица в кисло-остром соусе,300 г,Блюда из птицы,445 с,https://nambafood.kg/dish_image/65844.png
F5 Жареная курица с острым сухим перцем,400 г,Блюда из птицы,675 с,https://nambafood.kg/dish_image/65845.png
F6 Курица с кешью,300 г,Блюда из птицы,565 с,https://nambafood.kg/dish_image/65846.png
F7 Курица в самоваре,350 г,Блюда из птицы,665 с,https://nambafood.kg/dish_image/65847.png
F11 Курица с цветной капустой,300 г,Блюда из птицы,445 с,https://nambafood.kg/dish_image/65848.png
F12 Дапанджи,800 г,Блюда из птицы,775 с,https://nambafood.kg/dish_image/65849.png
F16 Курица с грибами чайного дерева,350 г,Блюда из птицы,610 с,https://nambafood.kg/dish_image/65850.png
F18 Пекинская утка,"1 шт. Филе, жареные косточки, суп.",Блюда из птицы,2080 с,https://nambafood.kg/dish_image/65851.png
G1 Жареные баклажаны с мясом,350 г,Блюда из овощей,495 с,https://nambafood.kg/dish_image/65855.png
G2 Жареные грибы в кляре,200 г,Блюда из овощей,365 с,https://nambafood.kg/dish_image/65856.png
G4 Тофу в остром соусе,300 г,Блюда из овощей,335 с,https://nambafood.kg/dish_image/65857.png
G5 Тофу по-домашнему,300 г,Блюда из овощей,355 с,https://nambafood.kg/dish_image/65859.png
G6 Превосходный творог из яиц,300 г,Блюда из овощей,395 с,https://nambafood.kg/dish_image/65860.png
G7 Тофу на жаровне,300 г,Блюда из овощей,395 с,https://nambafood.kg/dish_image/65862.png
G9 Тушеный тофу,300 г,Блюда из овощей,335 с,https://nambafood.kg/dish_image/65863.png
G10 Жареные брокколи с чесноком,300 г,Блюда из овощей,335 с,https://nambafood.kg/dish_image/65864.png
G13 Жареный помидор с яйцом,300 г,Блюда из овощей,335 с,https://nambafood.kg/dish_image/65865.png
G14 Жареный джусай с яйцом,300 г,Блюда из овощей,355 с,https://nambafood.kg/dish_image/65866.png
G15	Жареный маш с жусаем,300 г,Блюда из овощей,315 с,https://nambafood.kg/dish_image/65867.png
G16	Жареные джусай с сушеным тофу,300 г,Блюда из овощей,335 с,https://nambafood.kg/dish_image/65868.png
G17 Цветная капуста в самоваре,300 г,Блюда из овощей,365 с,https://nambafood.kg/dish_image/65870.png
G18 Картошка в самоваре,300 г,Блюда из овощей,335 с,https://nambafood.kg/dish_image/65871.png
G19 Жареная полусырая картошка,300 г,Блюда из овощей,315 с,https://nambafood.kg/dish_image/65872.png
G20 Жареные баклажаны в соевом соусе,300 г,Блюда из овощей,335 с,https://nambafood.kg/dish_image/65874.png
G22 Жареный шпинат с чесноком,300 г,Блюда из овощей,355 с,https://nambafood.kg/dish_image/65875.png
G23 Жареная фасоль в кляре,300 г,Блюда из овощей,415 с,https://nambafood.kg/dish_image/65884.png
G25 Жареная капуста с перцем,300 г,Блюда из овощей,315 с,https://nambafood.kg/dish_image/65883.png
G26 Жареный баклажан с перцем,300 г,Блюда из овощей,355 с,https://nambafood.kg/dish_image/65881.png
G28 Жареный бамбук с перцем,300 г,Блюда из овощей,375 с,https://nambafood.kg/dish_image/65878.png
G29	Фунчоза на жаровне,300 г,Блюда из овощей,365 с,https://nambafood.kg/dish_image/65877.png
M1 Пампушка,1 шт.,Гарниры,50 с,https://nambafood.kg/dish_image/65887.png
M2 Лепешка,1 шт.,Гарниры,40 с,https://nambafood.kg/dish_image/65888.png
M3 Картофель фри,150 г,Гарниры,120 с,https://nambafood.kg/dish_image/66647.png
M4 Пельмени с бараниной,20 шт.,Гарниры,300 с,https://nambafood.kg/dish_image/65890.png
M5 Пельмени с джусаем и яйцом,20 шт.,Гарниры,300 с,https://nambafood.kg/dish_image/65891.png
M6 Пельмени с говядиной,20 шт.,Гарниры,300 с,https://nambafood.kg/dish_image/65892.png
M7 Рис,,Гарниры,60 с,https://nambafood.kg/dish_image/65893.png
M8 Жареный рис с яйцом,300 г,Гарниры,130 с,https://nambafood.kg/dish_image/65897.png
M9 Жареный рис с колбасой,300 г,Гарниры,140 с,https://nambafood.kg/dish_image/65896.png
M10 Жареный рис с морепродуктами,300 г,Гарниры,320 с,https://nambafood.kg/dish_image/65895.png
M14 Жареная лапша с мясом,300 г,Гарниры,280 с,https://nambafood.kg/dish_image/65894.png
Coca-Cola 1 л,1 л,Напитки,100 с,https://nambafood.kg/dish_image/65898.png
"Coca-Cola 1,5 л",,Напитки,150 с,https://nambafood.kg/dish_image/143450.png
