Наименование,Описание,Категория,Цена,Фото
A2 Утиное мясо в чесночном соусе,260 г,Салаты,450 с,https://nambafood.kg/dish_image/81401.png
A4 Ароматная говядина,200 г,Салаты,495 с,https://nambafood.kg/dish_image/66071.png
A5 Говядина с огурцами,300 г,Салаты,455 с,https://nambafood.kg/dish_image/66072.png
A6  Морская капуста,300 г,Салаты,350 с,https://nambafood.kg/dish_image/66081.png
A7 Шинкованные бычьи легкие с говядиной,300 г,Салаты,515 с,https://nambafood.kg/dish_image/131335.png
A8 Говяжий язык,300 г,Салаты,455 с,https://nambafood.kg/dish_image/66073.png
A9 Требуха в масле чили,300 г,Салаты,420 с,https://nambafood.kg/dish_image/66082.png
A10 Черная фунчоза,300 г,Салаты,345 с,https://nambafood.kg/dish_image/66093.png
A11 Черные грибы с луком,300 г,Салаты,345 с,https://nambafood.kg/dish_image/66078.png
A12 Черное яйцо с перцем,200 г,Салаты,420 с,https://nambafood.kg/dish_image/66077.png
A13 Черные грибы в остром соусе,300 г,Салаты,365 с,https://nambafood.kg/dish_image/83777.png
A14  Грибы «Золотые нити» в остром соусе,200 г,Салаты,345 с,https://nambafood.kg/dish_image/66080.png
A15 Шпинат с тонкой фунчозой,200 г,Салаты,335 с,https://nambafood.kg/dish_image/66099.png
A16 Шпинат с грибами,200 г,Салаты,345 с,https://nambafood.kg/dish_image/66079.png
A17 Шпинат в имбирно-соевом соусе,240 г,Салаты,335 с,https://nambafood.kg/dish_image/66083.png
A20	Цыпленок на пару под соусом,300 г,Салаты,495 с,https://nambafood.kg/dish_image/81784.png
A21 Острая курица «Жомажи»,600 г,Салаты,920 с,https://nambafood.kg/dish_image/66069.png
A22  Баклажаны в чесночном соусе,240 г,Салаты,345 с,https://nambafood.kg/dish_image/66084.png
A23 Огурцы в чесночном соусе,300 г,Салаты,310 с,https://nambafood.kg/dish_image/66085.png
A24 Шпинат с арахисом,200 г,Салаты,335 с,https://nambafood.kg/dish_image/81785.png
A27 Брокколи в чесночном соусе,260 г,Салаты,335 с,https://nambafood.kg/dish_image/66092.png
A28 Огурцы с помидорами в соевом соусе,300 г,Салаты,315 с,https://nambafood.kg/dish_image/66086.png
A29 Крахмал «Лянфэнь»,260 г,Салаты,290 с,https://nambafood.kg/dish_image/66094.png
A33  Спаржа с огурцами,300 г,Салаты,345 с,https://nambafood.kg/dish_image/66096.png
A34 Холодный маш в соусе,260 г,Салаты,275 с,https://nambafood.kg/dish_image/66097.png
A36 Холодный шинкованный картофель в соусе,260 г,Салаты,275 с,https://nambafood.kg/dish_image/83780.png
B1  Кисло-острый суп с фунчезой,800 г,Супы,360 с,https://nambafood.kg/dish_image/66104.png
B7  Суп с зеленью,800 г,Супы,315 с,https://nambafood.kg/dish_image/66105.png
B8  Суп с зеленью и тофу,800 г,Супы,310 с,https://nambafood.kg/dish_image/66106.png
B9 Суп с яицом и морскими водорослями,800 г,Супы,325 с,https://nambafood.kg/dish_image/66107.png
B10  Суп с помидорами и яйцом,800 г,Супы,315 с,https://nambafood.kg/dish_image/66108.png
B12  Суп с измельченным мясом и яйцом,800 г,Супы,335 с,https://nambafood.kg/dish_image/66110.png
C3 Говядина соломкой в рыбном соусе,300 г,Говядина,470 с,https://nambafood.kg/dish_image/83790.png
C4 Домашняя жареная говядина с перцем,300 г,Говядина,465 с,https://nambafood.kg/dish_image/66121.png
C5 Жареная говядина с жусаем,300 г,Говядина,465 с,https://nambafood.kg/dish_image/66292.png
C6 Говядина соломкой с острым перцем,300 г,Говядина,475 с,https://nambafood.kg/dish_image/66120.png
C7 Говядина с грибами,300 г,Говядина,475 с,https://nambafood.kg/dish_image/66123.png
C8 Говядина в кисло-сладком соусе,300 г,Говядина,455 с,https://nambafood.kg/dish_image/66134.png
C9 Говядина в кисло-остром соусе,300 г,Говядина,455 с,https://nambafood.kg/dish_image/66135.png
C10 Говядина с сельдереем,300 г,Говядина,455 с,https://nambafood.kg/dish_image/66136.png
C11 Говядина с бамбуками,300 г,Говядина,470 с,https://nambafood.kg/dish_image/66137.png
C12 Говядина с овощами в соусе чили,350 г,Говядина,535 с,https://nambafood.kg/dish_image/66139.png
C13 Говядина с овощами,300 г,Говядина,455 с,https://nambafood.kg/dish_image/66138.png
C14 Говядина со стрелками чеснока,300 г,Говядина,465 с,https://nambafood.kg/dish_image/66140.png
C15 Говядина со спаржей,300 г,Говядина,465 с,https://nambafood.kg/dish_image/66141.png
C16 Говядина с черными грибами,300 г,Говядина,470 с,https://nambafood.kg/dish_image/66142.png
C17 Говядина на жаровне,300 г,Говядина,445 с,https://nambafood.kg/dish_image/66143.png
C18 Говяжьи кишки на жаровне,300 г,Говядина,480 с,https://nambafood.kg/dish_image/66144.png
C20 Жареные кусочки говядины с перцем и пампушками,300 г,Говядина,510 с,https://nambafood.kg/dish_image/66146.png
C21 Говядина в самоваре,350 г,Говядина,595 с,https://nambafood.kg/dish_image/66145.png
C22 Смешанная говядина,400 г,Говядина,535 с,https://nambafood.kg/dish_image/66147.png
C24 Баранина с капустой и фунчозой,400 г,Говядина,515 с,https://nambafood.kg/dish_image/66215.png
C25 Говядина с капустой и фунчозой,400 г,Говядина,515 с,https://nambafood.kg/dish_image/66148.png
C26 Жареная говяжая требуха,300 г,Говядина,480 с,https://nambafood.kg/dish_image/83791.png
C27 Говядина пряно-остром соусе,350 г,Говядина,535 с,https://nambafood.kg/dish_image/66150.png
C28 Яйцо на пару с говядиной,400 г,Говядина,535 с,https://nambafood.kg/dish_image/83792.png
C29 Говядина нарезанная соломкой с перцем,300 г,Говядина,455 с,https://nambafood.kg/dish_image/66122.png
C30 Голубцы с перцем по-китайски,300 г,Говядина,565 с,https://nambafood.kg/dish_image/66151.png
E1 Жареная «Рыба-виноград» в кисло-остром соусе,Цена за 1 кг.,Морепродукты,910 с,https://nambafood.kg/dish_image/66185.png
E2 Жареная «Рыба-виноград» в кисло-сладком соусе,Цена за 1 кг.,Морепродукты,910 с,https://nambafood.kg/dish_image/66186.png
E3 Рыба кусочками в кисло-остром соусе,300 г,Морепродукты,445 с,https://nambafood.kg/dish_image/66170.png
E4 Рыба кусочками в кисло-сладком соусе,300 г,Морепродукты,445 с,https://nambafood.kg/dish_image/66294.png
E5 Хрустящая рыба в кляре,10 шт.,Морепродукты,465 с,https://nambafood.kg/dish_image/66167.png
E6 Жареная мойва,10 шт.,Морепродукты,465 с,https://nambafood.kg/dish_image/66177.png
E7 Свежая рыба в чесночном соусе,Цена на 1 кг.,Морепродукты,980 с,https://nambafood.kg/dish_image/66295.png
E9 Свежая рыба с маринованной капустой,Цена на 1 кг.,Морепродукты,980 с,https://nambafood.kg/dish_image/66162.png
E10 Отварная свежая рыба в остром сычуаньском соусе,Цена на 1 кг.,Морепродукты,980 с,https://nambafood.kg/dish_image/66160.png
E11 Тушеная целая рыба в коричнево-соевом соусе,Цена на 1 кг.,Морепродукты,980 с,https://nambafood.kg/dish_image/66163.png
E15 Рыба кусочками на жаровне,300 г,Морепродукты,445 с,https://nambafood.kg/dish_image/66169.png
D1 Ребра баранины в самоваре,500 г,Блюда из баранины,1020 с,https://nambafood.kg/dish_image/66206.png
D2 Жареные бараньи ребра,500 г,Блюда из баранины,1020 с,https://nambafood.kg/dish_image/66207.png
D3 Жареные бараньи ребра с красным фасольем,500 г,Блюда из баранины,1020 с,https://nambafood.kg/dish_image/83801.png
D4 Тушеные бараньи ребра,500 г,Блюда из баранины,1020 с,https://nambafood.kg/dish_image/66210.png
D5 Дапанджи из бараньих ребер,800 г,Блюда из баранины,1020 с,https://nambafood.kg/dish_image/66216.png
D6 Жареная баранина с перцем,300 г,Блюда из баранины,455 с,https://nambafood.kg/dish_image/66208.png
D7 Жареная баранина с луком,300 г,Блюда из баранины,455 с,https://nambafood.kg/dish_image/66211.png
D8 Баранина в кисло-сладком соусе,300 г,Блюда из баранины,455 с,https://nambafood.kg/dish_image/66212.png
D9 Баранина в кисло-остром соусе,300 г,Блюда из баранины,455 с,https://nambafood.kg/dish_image/66213.png
D10 Баранина с перцем,300 г,Блюда из баранины,455 с,https://nambafood.kg/dish_image/66219.png
D11 Шашлык из баранины по-китайски,300 г,Блюда из баранины,495 с,https://nambafood.kg/dish_image/66220.png
D12 Жареная баранина с блинчиками,300 г,Блюда из баранины,495 с,https://nambafood.kg/dish_image/66214.png
D13 Жареная говядина с блинчиками,300 г,Блюда из баранины,495 с,https://nambafood.kg/dish_image/66159.png
D14 Баранина на жаровне,300 г,Блюда из баранины,455 с,https://nambafood.kg/dish_image/66218.png
F1 Пекинская утка,"Филе, жареные косточки, суп. Время приготовления 2 часа.",Блюда из птицы,2080 с,https://nambafood.kg/dish_image/66221.png
F2 Курица по-гунбао,300 г,Блюда из птицы,455 с,https://nambafood.kg/dish_image/66223.png
F3 Курица с перцем,300 г,Блюда из птицы,445 с,https://nambafood.kg/dish_image/66224.png
F4 Курица в кисло-сладком соусе,300 г,Блюда из птицы,445 с,https://nambafood.kg/dish_image/66225.png
F5 Курица в кисло-остром соусе,300 г,Блюда из птицы,445 с,https://nambafood.kg/dish_image/66226.png
F6 Курица с кешью,300 г,Блюда из птицы,495 с,https://nambafood.kg/dish_image/66227.png
F7 Курица в самоваре,350 г.,Блюда из птицы,565 с,https://nambafood.kg/dish_image/66228.png
F9 Хрустящие куриные крылышки,10 шт.,Блюда из птицы,690 с,https://nambafood.kg/dish_image/66236.png
F10 Курица с цветной капустой,300 г,Блюда из птицы,445 с,https://nambafood.kg/dish_image/66233.png
F11 Дапанджи,800 г,Блюда из птицы,775 с,https://nambafood.kg/dish_image/66230.png
F17 Жареная курица с острым сухим перцем,400 г,Блюда из птицы,665 с,https://nambafood.kg/dish_image/66222.png
F18 Курица с хрустящим перцем,300 г,Блюда из птицы,495 с,https://nambafood.kg/dish_image/83803.png
G1 Жареные баклажаны с мясом,350 г,Блюда из овощей,455 с,https://nambafood.kg/dish_image/66265.png
G2 Жареные грибы в кляре,200 г,Блюда из овощей,355 с,https://nambafood.kg/dish_image/66268.png
G3 Тофу в остром соусе,300 г,Блюда из овощей,335 с,https://nambafood.kg/dish_image/66241.png
G4 Тофу по-домашнему,300 г,Блюда из овощей,345 с,https://nambafood.kg/dish_image/66242.png
G5 Превосходный творог из яиц,300 г,Блюда из овощей,395 с,https://nambafood.kg/dish_image/66243.png
G6 Тофу на жаровне,300 г,Блюда из овощей,395 с,https://nambafood.kg/dish_image/66244.png
G8 Тушеный тофу,300 г,Блюда из овощей,335 с,https://nambafood.kg/dish_image/66245.png
G9 Жареные брокколи с чесноком,300 г,Блюда из овощей,355 с,https://nambafood.kg/dish_image/66251.png
G10 Сушеный тофу с сельдереем,300 г,Блюда из овощей,355 с,https://nambafood.kg/dish_image/66255.png
G11 Жареный перец с яйцом,300 г,Блюда из овощей,395 с,https://nambafood.kg/dish_image/66246.png
G12 Жареный помидор с яйцом,300 г,Блюда из овощей,395 с,https://nambafood.kg/dish_image/66252.png
G13 Жареный жусай с яйцом,300 г,Блюда из овощей,395 с,https://nambafood.kg/dish_image/66256.png
G14 Жареный маш с жусаем,300 г,Блюда из овощей,295 с,https://nambafood.kg/dish_image/66253.png
G15 Жареный жусай с сушеным тофу,300 г,Блюда из овощей,315 с,https://nambafood.kg/dish_image/66254.png
G16 Цветная капуста в самоваре,300 г,Блюда из овощей,395 с,https://nambafood.kg/dish_image/66248.png
G17 Картошка в самоваре,300 г,Блюда из овощей,315 с,https://nambafood.kg/dish_image/66257.png
G18  Жареная полусырая картошка,300 г,Блюда из овощей,295 с,https://nambafood.kg/dish_image/66250.png
G19 Жареные баклажаны в соевом соусе,300 г,Блюда из овощей,315 с,https://nambafood.kg/dish_image/66258.png
G20 Жареные баклажаны с перцем и картофелем,300 г,Блюда из овощей,395 с,https://nambafood.kg/dish_image/83804.png
G21 Жареный шпинат с чесноком,300 г,Блюда из овощей,355 с,https://nambafood.kg/dish_image/66260.png
G23 Жареная капуста с перцем,300 г,Блюда из овощей,315 с,https://nambafood.kg/dish_image/66263.png
G24 Жареный баклажан с перцем,300 г,Блюда из овощей,375 с,https://nambafood.kg/dish_image/66264.png
G25 Жареные баклажаны с фасолью,300 г,Блюда из овощей,355 с,https://nambafood.kg/dish_image/66259.png
G26 Жареный бамбук с перцем,300 г,Блюда из овощей,365 с,https://nambafood.kg/dish_image/66266.png
G27 Фунчоза на жаровне,300 г,Блюда из овощей,375 с,https://nambafood.kg/dish_image/66267.png
G28 Зеленые перцы «Тигровая шкура»,300 г,Блюда из овощей,345 с,https://nambafood.kg/dish_image/83805.png
G29 Китайские ямсы с сельдереем,300 г,Блюда из овощей,510 с,https://nambafood.kg/dish_image/83806.png
G38 Жареные юбайсай с грибами сянгу,300 г,Блюда из овощей,420 с,https://nambafood.kg/dish_image/66269.png
M1  Пампушка,1 шт.,Гарниры,50 с,https://nambafood.kg/dish_image/66279.png
M2   Лепешка,1 шт.,Гарниры,40 с,https://nambafood.kg/dish_image/66280.png
M3 Картофель фри,150 г,Гарниры,130 с,https://nambafood.kg/dish_image/66650.png
M4 Пельмени с бараниной,20 шт.,Гарниры,300 с,https://nambafood.kg/dish_image/66274.png
M5 Пельмени с жусаем и яйцом,20 шт.,Гарниры,300 с,https://nambafood.kg/dish_image/66285.png
M6 Пельмени с говядиной,20 шт.,Гарниры,300 с,https://nambafood.kg/dish_image/66275.png
M7 Рис,,Гарниры,60 с,https://nambafood.kg/dish_image/66278.png
M8 Жареный рис с яйцом,300 г,Гарниры,130 с,https://nambafood.kg/dish_image/66281.png
M9 Жареный рис с колбасой,300 г,Гарниры,140 с,https://nambafood.kg/dish_image/66284.png
M10  Жареный рис с морепродуктами,300 г,Гарниры,320 с,https://nambafood.kg/dish_image/66283.png
M11 Лапша с маринованной капустой,200 г,Гарниры,200 с,https://nambafood.kg/dish_image/83807.png
M12 Жареная лапша с мясом,300 г,Гарниры,280 с,https://nambafood.kg/dish_image/66273.png
M13 Острая лапша со шпинатом,200 г,Гарниры,200 с,https://nambafood.kg/dish_image/83808.png
M14  Лагман,400 г,Гарниры,200 с,https://nambafood.kg/dish_image/66272.png
Coca cola 1 л,,Напитки,100 с,https://nambafood.kg/dish_image/66286.png
Fanta 1 л,,Напитки,100 с,https://nambafood.kg/dish_image/66287.png
Sprite 1 л,,Напитки,100 с,https://nambafood.kg/dish_image/66288.png
Соки J7 в ассортименте 1 л,,Напитки,150 с,https://nambafood.kg/dish_image/116667.png
Bonaqua без газа 1 л,,Напитки,60 с,https://nambafood.kg/dish_image/140732.png
Bonaqua с газом 1 л,,Напитки,60 с,https://nambafood.kg/dish_image/140733.png
