Наименование,Описание,Категория,Цена,Фото
Мясное ассорти,,Холодные закуски и салаты,580 с,https://nambafood.kg/dish_image/101288.png
Консервированные яйца с зеленым перцем,,Холодные закуски и салаты,360 с,https://nambafood.kg/dish_image/101289.png
Говяжья требуха,,Холодные закуски и салаты,300 с,https://nambafood.kg/dish_image/101290.png
Вареная говядина в остром соусе,,Холодные закуски и салаты,320 с,https://nambafood.kg/dish_image/101291.png
Салат из требухи,,Холодные закуски и салаты,300 с,https://nambafood.kg/dish_image/101292.png
Морская  капуста в кисло-остром соусе,,Холодные закуски и салаты,240 с,https://nambafood.kg/dish_image/101293.png
Холодная курица,,Холодные закуски и салаты,600 с,https://nambafood.kg/dish_image/101294.png
Курица в пряно-остром соусе,,Холодные закуски и салаты,690 с,https://nambafood.kg/dish_image/101295.png
Курица в средне-остром соусе,,Холодные закуски и салаты,600 с,https://nambafood.kg/dish_image/101296.png
Салат с луком и зеленью,,Холодные закуски и салаты,220 с,https://nambafood.kg/dish_image/101297.png
Маш в кисло-остром соусе,,Холодные закуски и салаты,200 с,https://nambafood.kg/dish_image/101298.png
Салат из спаржи,,Холодные закуски и салаты,240 с,https://nambafood.kg/dish_image/101299.png
Доуфу с зеленым луком,,Холодные закуски и салаты,180 с,https://nambafood.kg/dish_image/101300.png
Говядина с острым перцем,,Холодные закуски и салаты,380 с,https://nambafood.kg/dish_image/101555.png
Говядина с огурцами,,Холодные закуски и салаты,280 с,https://nambafood.kg/dish_image/101302.png
Огурцы с помидором,,Холодные закуски и салаты,200 с,https://nambafood.kg/dish_image/101556.png
Черная фунчоза в в кисло-остром соусе,,Холодные закуски и салаты,220 с,https://nambafood.kg/dish_image/101557.png
Шпинат с фунчозой,,Холодные закуски и салаты,240 с,https://nambafood.kg/dish_image/101305.png
Салат из черных грибов,,Холодные закуски и салаты,260 с,https://nambafood.kg/dish_image/101306.png
"Салат из моркови, морской капусты и фунчозы",,Холодные закуски и салаты,240 с,https://nambafood.kg/dish_image/101307.png
Капуста в кисло-остром соусе,,Холодные закуски и салаты,200 с,https://nambafood.kg/dish_image/101308.png
Черные яйца с доуфу,,Холодные закуски и салаты,260 с,https://nambafood.kg/dish_image/101309.png
Осётр на пару,,Блюда из рыбы и морепродуктов,1300 с,https://nambafood.kg/dish_image/101310.png
"Осетр ""Синпай"" острый",,Блюда из рыбы и морепродуктов,1300 с,https://nambafood.kg/dish_image/101558.png
Креветки с хрустящим перцем 0.7,,Блюда из рыбы и морепродуктов,900 с,https://nambafood.kg/dish_image/101312.png
Креветки с хрустящим перцем,,Блюда из рыбы и морепродуктов,1200 с,https://nambafood.kg/dish_image/101313.png
"Креветки с чесноком на пару 0,7",,Блюда из рыбы и морепродуктов,900 с,https://nambafood.kg/dish_image/101314.png
Креветки с чесноком на пару,,Блюда из рыбы и морепродуктов,1200 с,https://nambafood.kg/dish_image/101315.png
"Варёные креветки 0,7",,Блюда из рыбы и морепродуктов,900 с,https://nambafood.kg/dish_image/101316.png
Вареные креветки,,Блюда из рыбы и морепродуктов,1200 с,https://nambafood.kg/dish_image/101317.png
Креветки очищенные с сельдереем,,Блюда из рыбы и морепродуктов,580 с,https://nambafood.kg/dish_image/101319.png
"Жареные креветки 0,7",,Блюда из рыбы и морепродуктов,900 с,https://nambafood.kg/dish_image/101320.png
Жареные креветки,,Блюда из рыбы и морепродуктов,1200 с,https://nambafood.kg/dish_image/101321.png
Жареные морепродукты в горшочке,,Блюда из рыбы и морепродуктов,360 с,https://nambafood.kg/dish_image/101559.png
Запечённая рыба по-чунцински,,Блюда из рыбы и морепродуктов,1100 с,https://nambafood.kg/dish_image/101323.png
Филе рыбы в кисло-сладком соусе,,Блюда из рыбы и морепродуктов,320 с,https://nambafood.kg/dish_image/101324.png
Филе рыбы в кисло-остром соусе,,Блюда из рыбы и морепродуктов,320 с,https://nambafood.kg/dish_image/101325.png
Живая рыба с маринованными овощами,,Блюда из рыбы и морепродуктов,780 с,https://nambafood.kg/dish_image/101326.png
Филе рыбы на шпажках,,Блюда из рыбы и морепродуктов,320 с,https://nambafood.kg/dish_image/101327.png
Креветки на жаровне,,Блюда из рыбы и морепродуктов,450 с,https://nambafood.kg/dish_image/101560.png
Жареные кальмары с брокколи,,Блюда из рыбы и морепродуктов,450 с,https://nambafood.kg/dish_image/101329.png
Кальмары на жаровне,,Блюда из рыбы и морепродуктов,440 с,https://nambafood.kg/dish_image/101330.png
"Жареные креветки на огне 0,7",,Блюда из рыбы и морепродуктов,900 с,https://nambafood.kg/dish_image/101331.png
Жареные креветки на огне,,Блюда из рыбы и морепродуктов,1200 с,https://nambafood.kg/dish_image/101332.png
Филе рыбы на жаровне,,Блюда из рыбы и морепродуктов,320 с,https://nambafood.kg/dish_image/101561.png
Креветки очищенные с овощами,,Блюда из рыбы и морепродуктов,480 с,https://nambafood.kg/dish_image/101334.png
Запечённая рыба на огне,,Блюда из рыбы и морепродуктов,950 с,https://nambafood.kg/dish_image/101335.png
Креветки с фунчозой в горшочке,,Блюда из рыбы и морепродуктов,580 с,https://nambafood.kg/dish_image/101336.png
Судак в кисло-остром соусе в виде винограда,,Блюда из рыбы и морепродуктов,580 с,https://nambafood.kg/dish_image/101337.png
Тушёная рыба,,Блюда из рыбы и морепродуктов,980 с,https://nambafood.kg/dish_image/101338.png
Живая рыба в остром бульоне,,Блюда из рыбы и морепродуктов,780 с,https://nambafood.kg/dish_image/101339.png
Живая рыба на пару,,Блюда из рыбы и морепродуктов,780 с,https://nambafood.kg/dish_image/101340.png
Кальмары с овощами под соусом,,Блюда из рыбы и морепродуктов,480 с,https://nambafood.kg/dish_image/101341.png
Филе куриное в кисло-остром соусе,,Блюда из птицы,320 с,https://nambafood.kg/dish_image/101350.png
Филе куриное в кисло-сладком соусе,,Блюда из птицы,320 с,https://nambafood.kg/dish_image/101351.png
Жареный жусай с утиной кровью,,Блюда из птицы,260 с,https://nambafood.kg/dish_image/101352.png
Маосюэван,(блюдо на основе утиной крови),Блюда из птицы,620 с,https://nambafood.kg/dish_image/101353.png
Дапанджи,,Блюда из птицы,480 с,https://nambafood.kg/dish_image/101354.png
Филе куриное с арахисом и овощами,,Блюда из птицы,350 с,https://nambafood.kg/dish_image/101355.png
Филе куриное с бобами,,Блюда из птицы,350 с,https://nambafood.kg/dish_image/101356.png
Курица с кари на жаровне,,Блюда из птицы,300 с,https://nambafood.kg/dish_image/101357.png
Курица с перцем,,Блюда из птицы,380 с,https://nambafood.kg/dish_image/101358.png
Кусочки курицы с перцем в пряно-остром соусе,,Блюда из птицы,330 с,https://nambafood.kg/dish_image/101359.png
Куриные внутренности в кисло-остром соусе,,Блюда из птицы,300 с,https://nambafood.kg/dish_image/101360.png
Курица на огне,,Блюда из птицы,480 с,https://nambafood.kg/dish_image/101361.png
Жареная курица с острым перцем,,Блюда из птицы,380 с,https://nambafood.kg/dish_image/101362.png
Говяжьи внутренности на огне,,Блюда из говядины,380 с,https://nambafood.kg/dish_image/101363.png
Говядина в остром бульоне,,Блюда из говядины,480 с,https://nambafood.kg/dish_image/101364.png
Говядина на жаровне,,Блюда из говядины,320 с,https://nambafood.kg/dish_image/101365.png
"Доуфу с говядиной, грибами и креветками в горшочке",,Блюда из говядины,360 с,https://nambafood.kg/dish_image/101366.png
Говядина с сельдереем,,Блюда из говядины,360 с,https://nambafood.kg/dish_image/101367.png
Говядина с острым перцем,,Блюда из говядины,360 с,https://nambafood.kg/dish_image/101368.png
Говядина с маринованным перцем,,Блюда из говядины,360 с,https://nambafood.kg/dish_image/101369.png
Говядина по-монгольски,,Блюда из говядины,360 с,https://nambafood.kg/dish_image/101370.png
Говядина с черными грибами,,Блюда из говядины,360 с,https://nambafood.kg/dish_image/101371.png
Говядина со стрелками чеснока,,Блюда из говядины,360 с,https://nambafood.kg/dish_image/101562.png
Говядина с огурцами,,Блюда из говядины,360 с,https://nambafood.kg/dish_image/101373.png
Говядина с овощами,,Блюда из говядины,360 с,https://nambafood.kg/dish_image/101374.png
Шашлык из говядины,,Блюда из говядины,360 с,https://nambafood.kg/dish_image/101375.png
Говядина с грибами,,Блюда из говядины,360 с,https://nambafood.kg/dish_image/101376.png
Требуха с капустой и фунчозой,,Блюда из говядины,380 с,https://nambafood.kg/dish_image/101377.png
Говядина с зелёным перцем на жаровне,,Блюда из говядины,360 с,https://nambafood.kg/dish_image/101378.png
Говядина с черным перцем на жаровне,,Блюда из говядины,360 с,https://nambafood.kg/dish_image/101381.png
Требуха с кинзой,,Блюда из говядины,360 с,https://nambafood.kg/dish_image/101563.png
Говядина в сладко-остром соусе,,Блюда из говядины,360 с,https://nambafood.kg/dish_image/101382.png
Говядина с капустой и фунчозой,,Блюда из говядины,360 с,https://nambafood.kg/dish_image/101384.png
Говядина с луком и имбирём,,Блюда из говядины,360 с,https://nambafood.kg/dish_image/101385.png
Говяжьи внутренности с маринованным перцем,,Блюда из говядины,360 с,https://nambafood.kg/dish_image/101386.png
Говядина с грибами на огне,,Блюда из говядины,360 с,https://nambafood.kg/dish_image/101388.png
Говядина со спаржей,,Блюда из говядины,360 с,https://nambafood.kg/dish_image/101389.png
Жареная говядина с картофелем,,Блюда из говядины,360 с,https://nambafood.kg/dish_image/101390.png
Говядина в кисло-сладком соусе,,Блюда из говядины,360 с,https://nambafood.kg/dish_image/101391.png
Жареная говядина соломкой,,Блюда из говядины,360 с,https://nambafood.kg/dish_image/101392.png
Тушёная говядина,,Блюда из говядины,480 с,https://nambafood.kg/dish_image/101393.png
Говядина с перцем,,Блюда из говядины,360 с,https://nambafood.kg/dish_image/101394.png
Требуха с красным перцем,,Блюда из говядины,360 с,https://nambafood.kg/dish_image/101395.png
Требуха с сельдереем,,Блюда из говядины,360 с,https://nambafood.kg/dish_image/101396.png
Говяжья печень с маринованным перцем,,Блюда из говядины,360 с,https://nambafood.kg/dish_image/101397.png
Говядина со шпинатом в соусе,,Блюда из говядины,380 с,https://nambafood.kg/dish_image/101398.png
Говядина соломкой с машем,,Блюда из говядины,360 с,https://nambafood.kg/dish_image/101400.png
Говядина с острым зелёным перцем,,Блюда из говядины,360 с,https://nambafood.kg/dish_image/101401.png
Говядина с маринованными овощами,,Блюда из говядины,360 с,https://nambafood.kg/dish_image/101604.png
Говядина с бобами,,Блюда из говядины,360 с,https://nambafood.kg/dish_image/101603.png
Тушёные говяжьи фрикадельки,,Блюда из говядины,360 с,https://nambafood.kg/dish_image/101605.png
Мясо с доуфу,,Блюда из говядины,360 с,https://nambafood.kg/dish_image/101405.png
Хрустящие бараньи ребрышки,,Блюда из баранины,680 с,https://nambafood.kg/dish_image/101407.png
Баранина с тмином,,Блюда из баранины,360 с,https://nambafood.kg/dish_image/101408.png
Баранина с луком,,Блюда из баранины,360 с,https://nambafood.kg/dish_image/101564.png
Жареная баранина с красным перцем и сельдереем,,Блюда из баранины,360 с,https://nambafood.kg/dish_image/101410.png
Бараньи рёбрышки с овощами,,Блюда из баранины,480 с,https://nambafood.kg/dish_image/101576.png
Бараньи рёбрышки,,Блюда из баранины,580 с,https://nambafood.kg/dish_image/101412.png
Суп из говяжьего фарша и крахмала,,Супы,260 с,https://nambafood.kg/dish_image/101503.png
Яичный суп с водорослями,,Супы,220 с,https://nambafood.kg/dish_image/101504.png
Доуфу суп с овощами,,Супы,200 с,https://nambafood.kg/dish_image/101505.png
Суп из помидоров и яиц,,Супы,200 с,https://nambafood.kg/dish_image/101506.png
Кисло-острый суп,,Супы,300 с,https://nambafood.kg/dish_image/101508.png
Суп с клёцками,,Супы,240 с,https://nambafood.kg/dish_image/101509.png
Суп с морепродуктами,,Супы,350 с,https://nambafood.kg/dish_image/101510.png
Суп-лапша с квашеной капустой,,Супы,220 с,https://nambafood.kg/dish_image/101511.png
Суп из черных яиц и огурцов,,Супы,240 с,https://nambafood.kg/dish_image/101512.png
Чёрные грибы с яйцами,,Овощные блюда,200 с,https://nambafood.kg/dish_image/101452.png
Черные грибы с луком,,Овощные блюда,220 с,https://nambafood.kg/dish_image/101453.png
Жареный перец,,Овощные блюда,200 с,https://nambafood.kg/dish_image/101454.png
Жареный баклажан с фасолью,,Овощные блюда,260 с,https://nambafood.kg/dish_image/101565.png
Картофель соломкой,,Овощные блюда,200 с,https://nambafood.kg/dish_image/101456.png
Пекинская капуста в кисло-остром соусе,,Овощные блюда,200 с,https://nambafood.kg/dish_image/101457.png
Гребешки с брокколи,,Овощные блюда,880 с,https://nambafood.kg/dish_image/101566.png
Фунчоза на жаровне,,Овощные блюда,240 с,https://nambafood.kg/dish_image/101459.png
Сельдерей с бобами,,Овощные блюда,320 с,https://nambafood.kg/dish_image/101461.png
Доуфу в кисло-сладком соусе,,Овощные блюда,220 с,https://nambafood.kg/dish_image/101462.png
Жареный картофель,,Овощные блюда,220 с,https://nambafood.kg/dish_image/101567.png
Стручки фасоли в горшочке,,Овощные блюда,240 с,https://nambafood.kg/dish_image/101464.png
Зелёный перец с яйцами,,Овощные блюда,200 с,https://nambafood.kg/dish_image/101466.png
Доуфу в остром соусе,,Овощные блюда,200 с,https://nambafood.kg/dish_image/101467.png
Жусай с машем,,Овощные блюда,200 с,https://nambafood.kg/dish_image/101468.png
Доуфу по-домашнему,,Овощные блюда,220 с,https://nambafood.kg/dish_image/101470.png
Жареные яйца с помидорами,,Овощные блюда,220 с,https://nambafood.kg/dish_image/101471.png
Жусай с яйцами,,Овощные блюда,220 с,https://nambafood.kg/dish_image/101568.png
Зелёный лук с яйцом,,Овощные блюда,220 с,https://nambafood.kg/dish_image/101474.png
Ямс с черными грибами,,Овощные блюда,260 с,https://nambafood.kg/dish_image/101569.png
Жареные брокколи с чесноком,,Овощные блюда,240 с,https://nambafood.kg/dish_image/101570.png
Яйцо на пару,,Овощные блюда,200 с,https://nambafood.kg/dish_image/101478.png
Жареная капуста,,Овощные блюда,200 с,https://nambafood.kg/dish_image/101480.png
Вареная зелень,,Овощные блюда,200 с,https://nambafood.kg/dish_image/101481.png
Жареная зимняя тыква,,Овощные блюда,200 с,https://nambafood.kg/dish_image/101482.png
Черные яйца с овощами в соусе,,Овощные блюда,260 с,https://nambafood.kg/dish_image/101483.png
Фарш с яйцами на жаровне,,Овощные блюда,290 с,https://nambafood.kg/dish_image/101571.png
Жареный баклажан с перцем,,Овощные блюда,260 с,https://nambafood.kg/dish_image/101486.png
Огурцы с чесноком,,Овощные блюда,200 с,https://nambafood.kg/dish_image/101488.png
Доуфу в соевом соусе,,Овощные блюда,240 с,https://nambafood.kg/dish_image/101489.png
Тушёное доуфу,,Овощные блюда,240 с,https://nambafood.kg/dish_image/101572.png
Жарененное доуфу с жусаем и перцем,,Овощные блюда,200 с,https://nambafood.kg/dish_image/101492.png
Жареное доуфу в соусе,,Овощные блюда,240 с,https://nambafood.kg/dish_image/101493.png
Салат-латук с чесноком,,Овощные блюда,220 с,https://nambafood.kg/dish_image/101494.png
Ю Пай Цай с чесноком,,Овощные блюда,200 с,https://nambafood.kg/dish_image/101496.png
Шпинат с чесноком,,Овощные блюда,200 с,https://nambafood.kg/dish_image/101497.png
Цветки хризантемы,,Овощные блюда,220 с,https://nambafood.kg/dish_image/101498.png
Жареный маш,,Овощные блюда,260 с,https://nambafood.kg/dish_image/101499.png
Жареная тыква соломкой,,Овощные блюда,220 с,https://nambafood.kg/dish_image/101573.png
Стручки бобов на огне,,Овощные блюда,300 с,https://nambafood.kg/dish_image/101501.png
Цветная капуста на огне,,Овощные блюда,240 с,https://nambafood.kg/dish_image/101574.png
Жареная рисовая лапша с овощами,,Другие блюда и гарниры,220 с,https://nambafood.kg/dish_image/101513.png
Жареный рис «Янчжоу»,,Другие блюда и гарниры,150 с,https://nambafood.kg/dish_image/101514.png
Яичная лепешка с зеленым луком,,Другие блюда и гарниры,120 с,https://nambafood.kg/dish_image/101515.png
Жареный рис с яйцом,,Другие блюда и гарниры,150 с,https://nambafood.kg/dish_image/101516.png
Жареный рис с очищенными креветками,,Другие блюда и гарниры,190 с,https://nambafood.kg/dish_image/101517.png
Пампушка,,Другие блюда и гарниры,30 с,https://nambafood.kg/dish_image/101575.png
Рис отварной,,Другие блюда и гарниры,40 с,https://nambafood.kg/dish_image/101519.png
Лепешка,,Другие блюда и гарниры,30 с,https://nambafood.kg/dish_image/101520.png
Картофель фри,,Другие блюда и гарниры,120 с,https://nambafood.kg/dish_image/101521.png
Лимон,,Другие блюда и гарниры,80 с,https://nambafood.kg/dish_image/101522.png
"Минеральная вода Bonaqua 0,5 л",,Напитки,30 с,https://nambafood.kg/dish_image/140755.png
Газ. мин. Вода Bonaqua 0.5 л,,Напитки,30 с,https://nambafood.kg/dish_image/140752.png
Минеральная вода Bonaqua 1 л,,Напитки,50 с,https://nambafood.kg/dish_image/140753.png
Газ. мин. Вода Bonaqua 1 л,,Напитки,50 с,https://nambafood.kg/dish_image/140754.png
Минеральная вода Bonaqua 1.5 л,,Напитки,60 с,https://nambafood.kg/dish_image/140756.png
Газ. мин. Вода Bonaqua 1.5 л,,Напитки,60 с,https://nambafood.kg/dish_image/140757.png
Coca Cola баночная,,Напитки,40 с,https://nambafood.kg/dish_image/101529.png
Coca Cola 0.5 л,,Напитки,50 с,https://nambafood.kg/dish_image/101530.png
Coca Cola Zero 0.5 л,,Напитки,50 с,https://nambafood.kg/dish_image/101534.png
Fanta 0.5 л,,Напитки,50 с,https://nambafood.kg/dish_image/101536.png
Sprite 0.5 л,,Напитки,50 с,https://nambafood.kg/dish_image/101542.png
Coca Cola 1 л,,Напитки,80 с,https://nambafood.kg/dish_image/101531.png
Coca Cola Zero 1 л,,Напитки,80 с,https://nambafood.kg/dish_image/101535.png
Fanta 1 л,,Напитки,80 с,https://nambafood.kg/dish_image/101537.png
Sprite 1 л,,Напитки,80 с,https://nambafood.kg/dish_image/140758.png
Coca Cola 1.5 л,,Напитки,120 с,https://nambafood.kg/dish_image/101532.png
Fanta 1.5 л,,Напитки,120 с,https://nambafood.kg/dish_image/101541.png
Sprite 1.5 л,,Напитки,120 с,https://nambafood.kg/dish_image/140759.png
Coca Cola 2 л,,Напитки,140 с,https://nambafood.kg/dish_image/101533.png
Сок натуральный J7 1 л,в ассортименте,Напитки,150 с,https://nambafood.kg/dish_image/101544.png
Redbull,,Напитки,150 с,https://nambafood.kg/dish_image/101545.png
Китайский редбул,,Напитки,150 с,https://nambafood.kg/dish_image/101550.png
Энергетический напиток Flash,,Напитки,55 с,https://nambafood.kg/dish_image/101546.png
